{
  "id": "10474",
  "title": "Document 10474",
  "url": "https://vbpl.vn/TW/Pages/vbpq-toanvan.aspx?ItemID=10474",
  "info": {
    "Đối tượng hưởng trợ cấp": "Mức phụ cấp",
    "(1)": "(2)",
    "- Lái chính": "7 USD /1 giờ",
    "- Dẫn đường, lái phụ, cơ giới trên không": "6000đ/1 giờ",
    "- Tiếp viên": "4 USD /1 giờ",
    "- Dẫn đường lái phụ, cơ giới trên không": "5 USD /1 giờ",
    "- Giáo viên bay (lái, dẫn đường)": "20.000đ/1 giờ",
    "- Các giáo viên khác": "10.000đ/1 giờ",
    "- Lái chính, dẫn đường": "200.000đ/giờ",
    "- Các nhân viên khác": "150.000đ/giờ"
  },
  "content": "THÔNG TƯ\nCỦA BỘ TÀI CHÍNH\nQuy định chế độ phụ cấp công tác cho các đối tượng làm nhiệm vụ trên không\ncủa ngành hàng không dân dụng\nTheo đề nghị của Bộ Giao thông vận tải và Cục Hàng không dân dụng Việt Nam. Bộ Tài chính quy định chế độ phụ cấp công tác tính theo giờ bay cho các đối tượng làm nhiệm vụ trên không của Hàng không dân dụng như sau:\n1. Các đối tượng được áp dụng phụ cấp giờ bay gồm:\nLái máy bay gồm cả lái chính và lái phụ\nDẫn đường, cơ giới trên không.\nTiếp viên trên không.\n2. Các mức phụ cấp giờ bay được quy định cụ thể như sau:\nĐối tượng hưởng trợ cấp\nMức phụ cấp\n(1)\n(2)\n1. Phụ cấp giờ bay trong nước\n- Lái chính\n8000đ/1 giờ\n- Dẫn đường, lái phụ, cơ giới trên không\n6000đ/1 giờ\n- Tiếp viên\n4000đ/1 giờ\n2. Phụ cấp giờ bay ngoài nước\na) Dưới 5 giờ bay\n- Lái chính\n9 USD /1 giờ\n- Dẫn đường lái phụ, cơ giới trên không\n7 USD /1 giờ\n- Tiếp viên\n5 USD /1 giờ\nb) Trên 5 giờ bay\n- Lái chính\n7 USD /1 giờ\n- Dẫn đường lái phụ, cơ giới trên không\n5 USD /1 giờ\n- Tiếp viên\n4 USD /1 giờ\n3. Phụ cấp giờ bay huấn luyện\n- Giáo viên bay (lái, dẫn đường)\n20.000đ/1 giờ\n- Các giáo viên khác\n10.000đ/1 giờ\n4. Phụ cấp giờ bay thử\n- Lái chính, dẫn đường\n200.000đ/giờ\n- Các nhân viên khác\n150.000đ/giờ\nTrong trường hợp đưa máy bay đi sửa chữa nước ngoài thì trong thời gian bay được hưởng các mức quy định như cán bộ công nhân viên bay ở ngoài nước; thời gian lưu trú tại nước ngoài hưởng phụ cấp lưu trú như cán bộ đi công tác tại nước đó (theo Thông tư số 37 TC/TCĐN ngày 18-6-1991 và Thông tư số 32 TC/TCĐN ngày 21-7-1992 của Bộ Tài chính).\n3. Các mức phụ cấp nêu trên thay cho chế độ công tác phí đối với các đối tượng làm nhiệm vụ trên không nêu tại điểm 1 Thông tư này và được hạch toán vào chi phí kinh doanh của ngành.\nThông tư này có hiệu lực từ 1-1-1993 và được vận dụng khi xử lý quyết toán năm 1992 của Tổng công ty Hàng không Việt Nam. Các quy định trái với Thông tư này đều được bãi bỏ./.",
  "content_length": 1899,
  "crawled_at": "2025-12-11T17:08:22.566286"
}