{
  "id": "10484",
  "title": "Document 10484",
  "url": "https://vbpl.vn/TW/Pages/vbpq-toanvan.aspx?ItemID=10484",
  "info": {
    "Thu nhập chịu thuế": "=",
    "Bậc": "Thu nhập chịu thuế 1 lần phát sinh",
    "2": "Giá vốn",
    "3": "Thu nhập chịu thuế",
    "4": "Thuế phải nộp theo Pháp lệnh",
    "5": "19.000.000đ",
    "6": "28.000.000đ",
    "7": "50.000.000đ",
    "CỤC THUẾ...Chi cục thuế...": "CỘNG HOÀ XÃ HỘI CHỦ NGHĨA VIỆT NAMĐộc lập - Tự do - Hạnh phúc",
    "Số TT": "Nội dung",
    "1": "2",
    "Xác nhận về người khai của UBNDphường (xã)(Ký, đóng dấu)": "Ngày... tháng... năm....Người khai(Ký, viết rõ họ tên)",
    "Ngày... tháng... năm....Cán bộ kiểm tra(Ký, viết rõ họ tên)": "Ngày... tháng.... năm...Cán bộ tính thuế(Ký, viết rõ họ tên)",
    "Xác nhận và đề nghị của UBND địa phương hoặc cơ quan quản lý(Ký tên, đóng dấu)": "Xác nhận của Chi cục thuế địa phương(Ký tên, đóng dấu)",
    "- Vị trí mặt đường (K1)": "Hệ số 1 đến 1,5",
    "- Thuận lợi kinh doanh (K2)": "Hệ số 1,2 đến 2",
    "- Trong ngõ hẻm (K3)": "\" 0,6 \" 0,8",
    "- Xa mặt đường (K4)": "\" 0,4 \" 0,6",
    "- Không thuận lợi về kinh doanh, sinh hoạt (K5)": "\" 0,5 \" 0,7",
    "- Đô thị miền núi (K6)": "đến 0,4",
    "- Đô thị Trung du (K7)": "\" 0,8",
    "- Đô thị Đồng bằng (K8)": "\" 1,0",
    "- Đô thị Ven biển (K9)": "\" 1,1",
    "Nhà": "Hệ số các tầng",
    "1 tầng (lầu trệt)": "1",
    "2 tầng (lầu 1)": "0,7",
    "3 tầng (lầu 2)": "0,7",
    "4 tầng (lầu 3)": "0,7",
    "Các khu vực": "Biệt thự (hạng)",
    "Thành phố Hà Nội": "1.100",
    "Thành phố Hồ Chí Minh": "1.200",
    "Các đô thị cấp II": "1.100",
    "Đồng bằng Bắc Bộ": "900",
    "Đồng bằng Nam Bộ": "1.100",
    "Trung du": "1.100",
    "Miền núi": "1.100",
    "Khu vực đất": "Vùng lãnh thổ",
    "Đô thị loại I": "28. Plây Cu",
    "1. Hồ Chí Minh": "29. Hoà Bình",
    "2. Hà Nội": "30. Rạch Giá",
    "II. Đô thị loại II": "31. Thái Bình",
    "3. Đà Nẵng": "32. Yên Bái",
    "4. Hải Phòng": "33. Tuy Hoà",
    "5. Huế": "34. Cao Lãnh",
    "6. Cần Thơ": "35. Hải Dương",
    "7. Biên Hoà": "36. Châu Đốc",
    "III. Đô thị loại III": "37. Sa Đéc",
    "8. Nha Trang": "38. Tân An",
    "9. Nam Định": "39. Bắc Giang",
    "10. Quy Nhơn": "40. Uông Bí",
    "11. Vũng Tàu": "41. Trà Vinh",
    "12. Long Xuyên": "42. Tam Kỳ",
    "13. Đà Lạt": "IV. Đô thị loại IV",
    "14. Thái Nguyên": "43. Bến Tre",
    "15. Vinh": "44. Thủ Dầu Một",
    "16. Mỹ Tho": "45. Hà Đông",
    "17. Hòn Gai": "46. Đông Hà",
    "18. Phan Thiết": "47. Quãng Ngãi",
    "19. Cẩm Phả": "48. Sơn Tây",
    "20. Buôn Mê Thuột": "49. Tây Ninh",
    "21. Vĩnh Long": "50. Bắc Ninh",
    "22. Sóc Trăng": "51. Kon Tum",
    "23. Thanh Hoá": "52. Sơn La",
    "24. Cà Mau": "53. Lạng Sơn",
    "25. Bạc Liêu": "54. Ninh Bình",
    "26. Việt Trì": "55. Cao Bằng",
    "27. Phan Rang": "56. Vĩnh Yên"
  },
  "content": "THÔNG TƯ\nCỦA BỘ TÀI CHÍNH\nHướng dẫn thi hành Nghị quyết của Uỷ ban Thường vụ Quốc hội và Nghị định của Chính phủ về việc bổ sung Pháp lệnh thuế thu nhập đối với người có thu nhập cao\nCăn cứ vào Pháp lệnh Thuế thu nhập đối với người có thu nhập cao đã được Hội đồng Nhà nước thông qua ngày 27 tháng 12 năm 1990;\nCăn cứ vào Nghị quyết số 32/NQ-UBTVQH9 ngày 10 tháng 3 năm 1993 của Uỷ ban Thường vụ Quốc hội \"về việc bổ sung Pháp lệnh Thuế thu nhập đối với người có thu nhập cao\" và Nghị định số 16-CP ngày 23 tháng 3 năm 1993 của Chính phủ quy định chi tiết thi hành Nghị quyết trên;\nSau khi trao đổi thống nhất với Bộ Xây dựng, Bộ Tài chính hướng dẫn thực hiện như sau:\nI - PHẠM VI ÁP DỤNG\n1. Đối tượng nộp thuế thu nhập:\nMọi cá nhân định cư tại Việt Nam, không đăng ký kinh doanh mua bán nhà, nhưng có bán nhà cùng với việc chuyển quyền sử dụng đất có nhà đó, mà có thu nhập, đều phải nộp thuế thu nhập vào Ngân sách Nhà nước.\nTrường hợp hộ gia đình bán nhà, chuyển quyền sử dụng đất đối với nhà đất thuộc sở hữu hợp pháp đối với nhà và quyền sử dụng đối với đất của nhiều người thì người nộp thuế là những người đứng tên sở hữu nhà và quyền sử dụng đất đó.\n2. Thu nhập chịu thuế:\nThu nhập thuộc diện chịu thuế thu nhập không thường xuyên do việc bán nhà cùng với việc chuyển quyền sử dụng đất có nhà đó là khoản chênh lệch giữa giá bán và giá vốn của nhà gắn với quyền sử dụng đất của nhà đó; bao gồm các loại sau đây:\nNhà tự xây dựng;\nNhà được mua do chính sách hoá giá của Nhà nước.\nNhà mua lại của người khác;\nNhà được hưởng quyền thừa kế, nhà được biếu tặng.\nCác loại nhà khác được Pháp luật cho phép bán nhà cùng với việc chuyển quyền sử dụng đất có nhà đó.\nGiá bán và giá vốn được xác định như sau:\na. Giá bán: là giá thanh toán thực tế giữa người mua và người bán tại thời điểm bán nhà cùng với việc chuyển quyền sử dụng đất có nhà đó. Trường hợp người mua, người bán kê khai không đúng giá thực tế (thấp hơn giá tối thiểu) thì được tính theo bảng giá tối thiểu do Bộ Tài chính và Bộ Xây dựng quy định theo từng thời kỳ (kèm theo Thông tư này mức giá tối thiểu).\nb. Giá vốn: là chi phí thực tế để xây dựng hoặc mua nhà, chi phí trả cho việc nhận quyền sử dụng đất (lệ phí cấp đất, lệ phí trước bạ...). Chi phí về sửa chữa, cải tạo, nâng cấp, và các chi phí hợp lý, hợp lệ khác (nếu có).\nThu nhập chịu thuế được xác định theo công thức sau đây:\nĐối với nhà đất tự xây dựng:\nThu nhập chịu thuế\n=\nGiá bán thực tế\n-\nChi phí xây dựng nhà và nhận quyền sử dụng đất (nếu có)\n+\nChi phí cải tạo nâng cấp (nếu có)\n+\nLệ phí trước bạ,lệ phí cấp đất (nếu có)\nĐối với nhà đất được mua từ hoá giá nhà hoặc mua lại của người khác\nThu nhập chịu thuế\n=\ngiá bán thực tế\n-\nChi phí trả tiền mua nhà nhận quyền sử dụng đất\n+\nLệ phí trước bạ, lệ phí cấp đất\n(nếu có)\n+\nChi phí sửa chữa, cải tạo (nếu có)\nĐối với nhà đất được hưởng quyền thừa kế, biếu tặng\nThu nhập chịu thuế\n=\nGiá bán thực tế\n-\nTrị giá của nhà tại thời điểm thừa kế, biếu tặng\n+\nChi phí sửa chữa, cải tạo (nếu có)\n+\nLệ phí trước bạ, lệ phí cấp đất\n(nếu có)\nTrong đó:\nChi phí xây dựng được tính theo giá thành xây dựng nhà ở của Bộ Xây dựng quy định theo từng thời kỳ.\nChi phí mua nhà được tính theo giá thực tế mua ghi trên hợp đồng thoả thuận mua bán nhà. Trường hợp kê khai giá mua cao hơn giá thực tế thì lấy theo mức giá tối thiểu do Bộ Tài chính và Bộ Xây dựng quy định;\nTrị giá của nhà tại thời điểm được thừa kế, biếu tặng được tính theo giá tối thiểu do Bộ Tài chính và Bộ Xây dựng quy định;\nChi phí cải tạo, nâng cấp, sửa chữa (nếu có) được xác định trên cơ sở chi phí hợp lý, hợp lệ.\nRiêng các loại nhà đất được xây dựng, mua, thừa kế trước ngày 1 tháng 4 năm 1993 giá vốn được xác định theo mặt bằng giá tối thiểu tại thời điểm 1 tháng 4 năm 1993 (bao gồm giá nhà và giá chuyển quyền sử dụng đất).\nLệ phí trước bạ, lệ phí cấp đất được xác định trên cơ sở số tiền thực tế ghi trên biên lai, hoá đơn thu tiền do các cơ quan chức năng thu lệ phí, thu thuế cấp phát.\n3. Thu nhập do bán nhà cùng với việc chuyển quyền sử dụng đất có nhà đó không thuộc diện chịu thuế thu nhập theo quy định tại Thông tư này bao gồm:\nThu nhập do bán nhà và chuyển quyền sử dụng đất có nhà đó thuộc đối tượng kinh doanh của các tổ chức, cá nhân có đăng ký kinh doanh nhà, môi giới trong việc mua bán nhà, cho thuê nhà. Các nghiệp vụ này được nộp thuế theo chế độ kinh doanh công, thương nghiệp, dịch vụ.\nThu nhập do bán nhà và chuyển quyền sử dụng đất có nhà đó của các doanh nghiệp Nhà nước, của các cơ quan hành chính sự nghiệp, của lực lượng vũ trang và của các đoàn thể mà nhận kinh phí hoạt động từ Ngân sách Nhà nước.\nII - CĂN CỨ VÀ PHƯƠNG PHÁP TÍNH THUẾ:\n1. Căn cứ tính thuế:\nCăn cứ tính thuế thu nhập về thu nhập do bán nhà cùng với việc chuyển quyền sử dụng đất có nhà đó là thu nhập chịu thuế và thuế suất.\nThu nhập chịu thuế theo quy định tại Điểm 2 - Mục I của Thông tư này là thu nhập trong mỗi lần bán nhà cùng với việc chuyển quyền sử dụng đất có nhà đó.\nTrường hợp nhà, đất có quyền sở hữu và quyền sử dụng hợp pháp của nhiều người (được pháp luật công nhận) thì thu nhập chịu thuế được xác định trên cơ sở lấy tổng số thu nhập chia theo phần cho những người có quyền hợp pháp để làm căn cứ tính thuế.\nThuế thu nhập được tính bằng đồng tiền Việt Nam. Đối với các trường hợp bán nhà cùng với việc chuyển quyền sử dụng đất có nhà đó mà được thanh toán bằng ngoại tệ, bằng vàng hoặc hiện vật thì được quy đổi ra tiền Việt Nam để làm căn cứ tính thuế. Ngoại tệ được tính theo tỷ giá mua vào do Ngân hàng Nhà nước công bố; vàng và hiện vật được tính theo giá thị trường tại thời điểm bán nhà và chuyển quyền sử dụng đất có nhà đó.\nThuế suất đối với thu nhập do bán nhà cùng với việc chuyển quyền sử dụng đất có nhà đó được áp dụng theo Biểu thuế luỹ tiến từng phần, quy định tại Điều 7, Nghị định số 16-CP ngày 13 tháng 3 năm 1993 của Chính phủ.\n2. Phương pháp tính thuế:\nThuế thu nhập theo quy định tại Thông tư này được tính theo phương pháp luỹ tiến từng phần. Tổng sổ tiền thuế phải nộp bằng tổng số tiền thuế trong các bậc thuế của từng phần.\nVí dụ: Thu nhập chịu thuế 18.000.000 đồng thì thuế thu nhập được tính như sau:\nĐến 1.800.000 đồng = không phải nộp thuế\nTrên 1.800.000 đồng đến 3.800.000 đồng thuế suất 5%\nThuế phải nộp của phần này là:\n(3.800.000đ - 1.800.000đ) x 5% = 100.000 đồng\nTrên 3.800.000đ đến 9.500.000đ thuế suất 10%.\nThuế phải nộp của phần này là:\n(9.500.000đ - 3.800.000đ) x 10% = 570.000đ\nTrên 9.500.000đ đến 18.000.000đ thuế suất 15%\nThuế phải nộp của phần này là:\n(18.000.000đ - 9.500.000đ) x 15% = 1.275.000\nTổng số thuế phải nộp là:\n1.945.000đ = (100.000 + 570.000 + 1.275.000).\nĐể đơn giản kỹ thuật tính toán thuế thu nhập đối với thu nhập quy định tại Thông tư này được tính toán theo biểu sau đây:\nBậc\nThu nhập chịu thuế 1 lần phát sinh\nThuế suất (%)\nSố thuế thu nhập phải nộp\n1\nđến 1.800.000đ\n0\n0\n2\ntrên 1.800.000đ\n- 3.800.000đ\n5\nTNCT x 5% - 90.000đ\n3\n3.800.000đ\n- 9.500.000đ\n10\nTNCT x 10% - 280.000đ\n4\n9.500.000đ\n- 19.000.000đ\n15\nTNCT x 15% - 755.000đ\n5\n19.000.000đ\n- 28.000.000đ\n20\nTNCT x 20% - 1.705.000đ\n6\n28.000.000đ\n- 50.000.000đ\n30\nTNCT x 30% - 4.505.000đ\n7\n50.000.000đ\n60\nTNCT x 60% - 19.505.000đ\nTrong đó: Ký hiệu TNCT: Thu nhập chịu thuế\nTheo ví dụ trên thu nhập chịu thuế là 18.000.000 đồng\nTiền thuế phải nộp là:\n1.945.000đ = (18.000.000đ x 15% - 755.000đ)\nIII - KÊ KHAI NỘP THUẾ THU NHẬP\n1. Kê khai bán nhà cùng với việc chuyển quyền sử dụng đất có nhà đó:\nMọi cá nhân có bán nhà cùng với việc chuyển quyền sử dụng đất có nhà đó đều phải kê khai đầy đủ các giấy tờ cần thiết liên quan đến việc bán nhà cùng với việc chuyển quyền sử dụng đất có nhà đó với cơ quan thuế, bao gồm:\nDiện tích nhà, loại nhà; diện tích đất (bao gồm cả đất nền nhà) gắn với nhà đó;\nNguồn gốc nhà đất (nhà tự xây dựng, mua lại, thừa kế...) và các bản sao giấy tờ xác nhận quyền sở hữu, quyền sử dụng;\nSố người có quyền sở hữu, quyền sử dụng hợp pháp;\nTổng giá trị vốn, Tổng trị giá bán;\nHợp đồng mua bán nhà và chuyển quyền sử dụng đất có nhà đó.\n(Bảng kê khai theo mẫu đính kèm)\nViệc kê khai được thực hiện trong phạm vi 10 ngày, kể từ ngày bán nhà cùng với việc chuyển quyền sử dụng đất có nhà đó.\n2. Nộp tiền thuế thu nhập vào Ngân sách Nhà nước:\nSau khi tiếp nhận tờ kê khai của người bán nhà cùng với việc chuyển quyền sử dụng đất có nhà đó, cơ quan thuế địa phương cử tổ cán bộ thuế kiểm tra tờ khai của người bán, xác định vị trí nhà, đất; diện tích nhà, diện tích đất, cấp nhà... Căn cứ vào tờ khai, số liệu kiểm tra, biểu giá nhà, chuyển quyền sử dụng đất tối thiểu; Bộ phận tính thuế thực hiện việc kiểm tra, xác định giá bán, giá vốn, thu nhập chịu thuế, thuế thu nhập phải nộp, có chữ ký xác nhận của Chi cục trưởng Chi cục thuế hoặc trưởng phòng thuế trước bạ địa phương.\nCăn cứ vào số liệu tính toán của cơ quan thuế, người bán nhà chuyển quyền sử dụng đất phải nộp 1 lần toàn bộ số tiền thuế vào NSNN trong phạm vi 30 ngày kể từ ngày bán nhà, chuyển quyền sử dụng đất.\nTiền thuế được nộp vào Kho bạc Nhà nước tại địa phương nơi phát sinh thu nhập chịu thuế, tương ứng với loại khoản hạng của mục lục NSNN quy định cho việc thuế thu nhập.\nIII - GIẢM, MIỄN THUẾ THU NHẬP\n1. Đối tượng được giảm, miễn thuế thu nhập:\na. Được miễn thuế thu nhập:\nCác trường hợp do hợp lý hoá gia đình, hoặc do hoàn cảnh khó khăn bắt buộc phải bán nhà cùng với việc chuyển quyền sử dụng đất có nhà đó.\nCác trường hợp do di chuyển gia đình đến nơi khác, do di chuyển công tác đi nơi khác, đi xây dựng vùng kinh tế mới, chuyển gia đình đi địa phương khác để sinh sống, phải bán nhà cùng với việc chuyển quyền sử dụng đất có nhà đó.\nb. Được giảm thuế:\nCác hộ gia đình thuộc diện chính sách; gia đình thương binh, liệt sĩ, gia đình có công với cách mạng có bán nhà cùng với việc chuyển quyền sử dụng đất có nhà đó mà có thu nhập chịu thuế.\nCác hộ gia đình có khó khăn đột xuất do thiên tai, địch hoạ như lụt bão, hoả hoạn, tai nạn bất ngờ; do mắc bệnh hiểm nghèo, ốm đau dài ngày phải bán nhà cùng với việc chuyển quyền sử dụng đất có nhà đó mà có thu nhập chịu thuế.\nc. Mức miễn, giảm:\nViệc xét miễn, giảm thuế chỉ được xét cho một lần miễn hoặc giảm thuế như phần a, b của Điểm 1 này.\nCăn cứ vào mức độ khó khăn của các hộ gia đình để xét tỷ lệ giảm thuế tương ứng, nhưng mức giảm tối đa không quá 50% số thuế phải nộp.\n2. Thủ tục và thẩm quyền miễn, giảm thuế:\nCác cá nhân thuộc diện được xét miễn, giảm thuế phải làm thủ tục kê khai thu nhập với cơ quan thuế; đồng thời làm đơn xin miễn, giảm thuế (theo mẫu đính kèm) nêu rõ lý do xin miễn, giảm số tiền thuế xin miễn, giảm.\nĐơn xin miễn, giảm thuế: đối với cán bộ công nhân viên chức phải có ý kiến xác nhận của cơ quan quản lý cán bộ công nhân viên; Đối với nhân dân phải có ý kiến xác nhận Uỷ ban nhân dân phường, xã và Chi cục thuế nơi có nhà bán.\nThủ tục miễn, giảm quy định cụ thể như sau:\na. Miễn thuế:\nĐối với trường hợp do hợp lý hoá gia đình, hoặc do di chuyển công tác, di chuyển chỗ ở đến nơi khác (trong hoặc ngoài địa phương) phải bán nhà cùng với việc chuyển quyền sử dụng đất có nhà đó để mua hoặc xây dựng lại nhà khác mà có xác nhận đầy đủ ý kiến của cơ quan quản lý, chính quyền địa phương, và chứng minh được bản thân chỉ có một nhà duy nhất và bán lần đầu thì được miễn thuế.\nĐối với trường hợp nhà cùng với đất gắn với nhà đó, thuộc quyền thừa kế hợp pháp của nhiều người được đem bán nhà cùng với việc chuyển quyền sử dụng đất có nhà đó để mua, xây dựng lại nhà khác mà người bán có giấy tờ chứng minh quyền thừa kế hợp pháp, có xác nhận của chính quyền và Chi cục thuế địa phương, thì được miễn thuế.\nb. Giảm thuế:\nĐối với các trường hợp thuộc diện giảm thuế: thì căn cứ vào bảng kê khai bán nhà cùng với việc chuyển quyền sử dụng đất có nhà đó, đơn xin giảm thuế có xác nhận của chính quyền địa phương, cơ quan quản lý các cá nhân xin giảm thuế, ý kiến của Chi cục thuế địa phương; việc giảm thuế được xử lý như sau:\nĐối với gia đình thuộc diện chính sách, gia đình thương binh liệt sĩ, gia đình có công với cách mạng được giảm thuế theo tỷ lệ thống nhất 50%;\nĐối với gia đình có khó khăn đột xuất: do thiên tai bão lụt, hoả hoạn, tai nạn bất ngờ, bệnh tật hiểm nghèo, ốm đau dài ngày... thì căn cứ vào mức độ khó khăn và số tiền thực chi cho các nhu cầu trên để xét giảm thuế tương ứng nhưng không quá 50% số thuế phải nộp.\nThẩm quyền xét miễn, giảm thuế do Cục trưởng Cục thuế địa phương quyết định.\nIV. XỬ LÝ VI PHẠM VÀ KHEN THƯỞNG\n1. Xử lý vi phạm:\na. Đối với người nộp thuế:\nMọi cá nhân có hành vi trốn thuế, không khai báo, khai báo không trung thực, không đúng hạn, kéo dài thời hạn nộp thuế thì ngoài việc nộp đủ tiền thuế theo quy định tại Thông tư này còn bị phạt theo Điều 21 của Pháp lệnh Thuế thu nhập đối với người có thu nhập cao, Nghị định số 01-CP ngày 18 tháng 10 năm 1992 của Chính phủ \"về việc vi phạm hành chính trong lĩnh vực thuế\" và Thông tư số 11-TC/TCT ngày 24 tháng 2 năm 1993 của Bộ Tài chính, hướng dẫn thực hiện Nghị định trên; cụ thể:\nPhạt tiền từ 100.000 đồng đến 500.000 đồng cho việc kê khai thu nhập sau 10 ngày (kể từ khi bán nhà) hoặc khai không đủ các khoản mục quy định của cơ quan thuế.\nPhạt tiền từ 50.000 đồng đến 400.000 đồng đối với vi phạm lần đầu, từ 400.000 đồng đến 800.000 đồng đối với vi phạm lần thứ 2, đến 1.000.000 đồng nếu có tình tiết nặng đối với các vi phạm; không xuất trình đầy đủ các chứng từ tài liệu liên quan đến việc bán nhà, xác định giá bán, giá vốn làm cơ sở xác định thu nhập chịu thuế.\nPhạt tiền đối với các hành vi khai man trốn thuế như sau:\nVi phạm lần thứ nhất: phạt 1 lần\nVi phạm lần thứ 2: phạt 2 lần\nVi phạm lần thứ 3 trở lên: phạt 3 lần.\nTừng trường hợp vi phạm có tình tiết nặng thì lần vi phạm thứ nhất cũng có thể phạt từ 2 đến 3 lần số thuế gian lận.\nTrường hợp kéo dài thời hạn nộp thuế (sau 30 ngày kể từ ngày bán nhà; và mỗi ngày chậm nộp còn bị phạt 0,5% (năm phần nghìn) số tiền nộp chậm.\nb. Đối với cán bộ thuế:\nCán bộ thuế và các cá nhân khác lợi dụng chức quyền để chiếm dụng, tham ô tiền thuế; thiếu trách nhiệm hoặc cố tình xử lý sai cho người nộp thuế thì người đó phải nộp đủ tiền thuế vào Ngân sách Nhà nước; bồi thường cho người bị thiệt hại và bị xử lý theo Điều 24 của Pháp lệnh Thuế thu nhập đối với người có thu nhập cao.\n2. Khen thưởng:\nCác tổ chức, cá nhân có công phát hiện các vụ vi phạm về thuế thu nhập đối với thu nhập quy định tại Thông tư này, thì tuỳ theo tính chất, mức độ vụ việc, số tiền thuế được phát hiện và thuế thực thu vào Ngân sách Nhà nước, Bộ Tài chính sẽ trích thưởng bằng tiền theo chế độ quy định.\nV- TỔ CHỨC THỰC HIỆN\n1. Việc tổ chức thu thuế thu nhập không thường xuyên về thu nhập do bán nhà cùng với việc chuyển quyền sử dụng đất được giao cho bộ phận thu thuế trước bạ của các Cục thuế địa phương để thực hiện việc kiểm tra, đối chiếu thu lệ phí trước bạ và thu thuế thu nhập. Cục thuế chịu trách nhiệm hướng dẫn quy trình thu thuế trước bạ và thu thuế thu nhập về bán nhà cùng với việc chuyển quyền sử dụng đất có nhà đó, bảo đảm chặt chẽ, kiểm tra đối chiếu lẫn nhau, chống thất thu thuế.\n2. Cơ quan thuế các cấp có nhiệm vụ phổ biến hướng dẫn các cá nhân thuộc diện nộp thuế thu nhập thực hiện việc kê khai nộp thuế theo quy định tại Nghị định số 16-CP ngày 23 tháng 3 năm 1993 của Chính phủ và Thông tư này.\n3. Uỷ ban Nhân dân phường, xã, cơ quan quản lý nhà đất và các cơ quan chức năng có trách nhiệm phối hợp và tạo điều kiện cho cơ quan thuế thu đủ tiền thuế phát sinh vào Ngân sách Nhà nước.\n4. Thông tư này có hiệu lực thi hành từ ngày 1 tháng 4 năm 1993.\nTrong quá trình thực hiện, nếu có vấn đề gì vướng mắc, các địa phương, các ngành phản ánh về Bộ Tài chính (Tổng Cục thuế) để nghiên cứu giải quyết.\nCỤC THUẾ...\nChi cục thuế...\nCỘNG HOÀ XÃ HỘI CHỦ NGHĨA VIỆT NAM\nĐộc lập - Tự do - Hạnh phúc\nTỜ KHAI NỘP THUẾ THU NHẬP SỐ\n(Về thu nhập không thường xuyên do bán nhà cùng\nvới việc chuyển quyền sử dụng đất có nhà đó)\nHọ, tên.........................................Nam, nữ...\nChứng minh nhân dân số... do... cấp ngày... tháng... năm...\nNơi thường trú...\nLà chủ sở hữu nhà số... phố.... thuộc lô đất số... sổ địa chính... phường (xã)...\nQuận (Huyện)... tỉnh (thành phố)...\nNay bán nhà cùng với việc chuyển quyền sử dụng đất có nhà đó cho ông (bà)... chứng minh nhân dân số... do.......\ncấp ngày... tháng... năm... Nơi thường trú.......\nNguồn gốc nhà\nTự xây dựng Giấy phép XD số... ngày... tháng...\nnăm... do.... cấp.\nMua..... Ngày... tháng.... năm... của ông, bà......\nThừa kế,\nbiếu tặng Ngày ... tháng... năm.... của ông, bà.......\nNguồn gốc khác Lý do...........\n....................\nNhà đã trước bạ tại.... Biên lai số........ ngày... tháng.... năm.....\nLoại nhà:\nBiệt thự\nKhu tập thể (chung cư)\nNhà cao tầng .. Số tầng.......\nNhà tạm\nGhi chú: Các ô trống có ký hiệu nhà thuộc loại nào thì đánh dấu x vào ô trống tương ứng: Ví dụ: nhà mua: + Mua\nDiện tích sàn....... m2\nTrong đó:\nDT sàn tầng 1 (trệt)............. m2\nnt....... 2 ........................m2\n................ m2\n.............. m2\n................. m2\n.................. m2\nDiện tích đất chuyển quyền sử dụng do bán nhà.......... m2\nbao gồm:\nĐất xây nhà............. m2\nĐất xây dựng các công trình kèm theo................. m2\nĐất lối đi, đất trống trong khuôn viên.............. m2\nSố TT\nNội dung\nPhần kê khai của người bán nhà có TN\nGhi chú\nNgoại tệ, vàng kim khí quý (chỉ vàng)\nTiền Việt Nam (đ)\nQui đổi tiền Việt Nam (đ)\n1\n2\n3\n4\n5 = 3 + 4\n6\n1\nGiá bán nhà và chuyển quyền sử dụng đất\nGhi rõ giá vàng, tỷ giá ngoại tệ\nTrong đó: - Nhà\n- Quyền SDĐ\n2\nGiá vốn\n- ..................................\n- ..................................\n- ..................................\n- ..................................\n3\nThu nhập chịu thuế\n4\nThuế phải nộp\nXác nhận về người khai của UBND\nphường (xã)\n(Ký, đóng dấu)\nNgày... tháng... năm....\nNgười khai\n(Ký, viết rõ họ tên)\nPHẦN DÀNH CHO CƠ QUAN THUẾ\nI- VỊ TRÍ NHÀ, ĐẤT VÀ DIỆN TÍCH\n1. Nhà bán thuộc:\nLô đất ở vị trí (1, 2, 3, 4)\nLoại đường phố, khu phố (loại 1, 2, 3, 4)\nLoại đô thị (I, II, III, IV, V, thị trấn)\n2. Diện tích nhà................. m2\nTrong đó: diện tích sàn tầng 1.............. m2\n............ 2.................... m2\n................................. m2\n............ 6.................... m2\n3. Diện tích đất gắn với việc bán nhà.................. m2\nBao gồm:\nĐất xây cất nhà trên đó.................. m2\nĐất XD các công trình trên đó................... m2\nĐất lối đi, đất trống trong khuôn viên............. m2\nII- TÍNH THUẾ\nSố TT\nNội dung\nNgoại tệ, vàng kim khí quý (chỉ vàng)\nTiền Việt Nam (đ)\nQui đổi tiền Việt Nam (đ)\nGhi chú\n1\n2\n3\n4\n5\n6\n1\nGiá bán nhà và chuyển quyền sử dụng đất\nGhi rõ giá vàng, tỷ giá ngoại tệ\n- Nhà\n- Quyền sử dụng đất\n2\nGiá vốn\n- ..................................\n3\nThu nhập chịu thuế\n4\nThuế phải nộp theo Pháp lệnh\n5. Số thuế được miễn giảm.......... theo quyết định số......\nngày... tháng... năm.... của..............\n6.\nẤ\nn định số thuế phải nộp (4 - 5),.......... bằng chữ................\nNgày... tháng... năm....\nCán bộ kiểm tra\n(Ký, viết rõ họ tên)\nNgày... tháng.... năm...\nCán bộ tính thuế\n(Ký, viết rõ họ tên)\nNgày... tháng... năm...\nThủ trưởng cơ quan thuế\n(Ký tên, đóng dấu)\nCỘNG HOÀ XÃ HỘI CHỦ NGHĨA VIỆT NAM\nĐộc lập - Tự do - Hạnh phúc\nNgày... tháng... năm....\nĐƠN XIN MIỄN, GIẢM THUẾ THU NHẬP\n(Về thu nhập không thường xuyên do bán nhà cùng với việc\nchuyển quyền sử dụng đất có nhà đó)\nKính gửi:......\nHọ tên:........ Nam, nữ........\nChứng minh nhân dân số...... do.......\nCấp ngày........ tháng........ năm.........\nNơi thường trú..................\nBán nhà cùng với việc chuyển quyền sử dụng đất có nhà số..............\nPhố............. Thuộc lô đất số............ Sổ địa chính..........\nPhường (xã).......... Quận (huyện)..............\nTỉnh (thành phố)..................\nSố tiền thuế phải nộp theo chế độ quy định...............\nNay làm đơn đề nghị........... xét miễn giảm thuế thu nhập số tiền ................\nLý do xin miễn giảm..................\n.................\n.....................\nHồ sơ kèm theo:\nThẻ thương binh, giấy chứng nhận gia đình liệt sĩ.\nBằng gia đình có công với nước.\nQuyết định chuyển công tác, giấy di chuyển hộ khẩu.\nHồ sơ mua nhà mới hoặc xây dựng nhà khác.\nXác nhận và đề nghị của UBND địa phương hoặc cơ quan quản lý\n(Ký tên, đóng dấu)\nXác nhận của Chi cục thuế địa phương\n(Ký tên, đóng dấu)\nNgười đứng đơn\n(Ký, viết rõ họ tên)\nBẢNG GIÁ NHÀ, GIÁ CHUYỂN QUYỀN SỬ DỤNG ĐẤT TIÊU CHUẨN\nTỐI THIỂU\n(Ban hành kèm theo Thông tư số 29-TC/TCT ngày 1 tháng 4 năm 1993)\n1. Giá nhà:\nGiá nhà được xác định cho từng cấp nhà, căn cứ vào giá xây dựng trung bình của thị trường từng địa phương.\nViệc xác định các loại nhà căn cứ vào quy định tại điểm 1, 2 phần I Thông tư số 07-LB/TT của Liên Bộ TC-XD UBVGNN-TCQLRĐ ngày 30-9-1991.\nPhương pháp xác định giá nhà như sau:\nĐối với nhà mới xây dựng:\nGn = Sd x Gx\nGn là giá nhà\nSd là diện tích xây dựng\nGx là giá tiêu chuẩn tối thiểu xây dựng của nhà: đồng/m2 xây dựng.\nDiện tích xây dựng không phân biệt diện tích chính và diện tích phụ\n(xem phụ lục số 1: Bảng giá tiêu chuẩn tối thiểu nhà xây dựng mới: 1000 đ/m2\nĐối với nhà cũ:\nGn = SD x GX x H + Ct\nH là hệ số xác định giá trị còn lại của nhà\nCt là chi phí bổ sung, cải tạo...\n2. Giá chuyển quyền sử dụng đất:\nGiá chuyển quyền sử dụng đất được xác định cho từng loại đất, căn cứ vào giá hình thành thực tế trung bình trên thị trường ở từng địa phương.\nViệc phân loại đất căn cứ vào quy định tại Thông tư số 07-LB-TT ngày 30-9-1991:\nĐất phân loại theo 3 vùng: Đồng bằng, Trung du, miền núi.\nChia ra:\nĐô thị: các thành phố, thị xã, thị trấn.\nĐất nông thôn.\nĐô thị được phân thành 5 loại đô thị theo phụ lục số 3 đính kèm.\nĐối với các loại đô thị mới hình thành, chưa có tên trong bảng danh mục xếp hạng đô thị, thì tạm thời sắp xếp như sau:\nCác đô thị nơi có trụ sở UBND tỉnh xếp vào đô thị loại IV\nCác đô thị khác (trừ thị trấn) xếp vào đô thị loại V\nThị trấn.\nPhân loại theo vị trí đất: khu trung tâm, cận trung tâm, ven đô thị.\nTrong mỗi khu vực đất chia ra 4 hạng đất: hạng đặc biệt (A); hạng cao (B); hạng trung bình (C); hạng thấp (D).\nĐể đảm bảo giá chuyển quyền sử dụng đất xác định sát thực tế, gắn với khả năng sinh lời, giá trị sử dụng theo vị trí. Trên cơ sở mức giá chuẩn tối thiểu chuyển quyền sử dụng (xem phụ lục số 2) sử dụng hệ số tính đổi quy định tại điểm 3, mục A, phần II Thông tư số 07-LB-TT ngày 30-9-1991. (Hệ số K):\n- Vị trí mặt đường (K1):\nHệ số 1 đến 1,5\n- Thuận lợi kinh doanh (K2):\nHệ số 1,2 đến 2\n- Trong ngõ hẻm (K3):\n\" 0,6 \" 0,8\n- Xa mặt đường (K4):\n\" 0,4 \" 0,6\n- Không thuận lợi về kinh doanh, sinh hoạt (K5):\n\" 0,5 \" 0,7\n- Đô thị miền núi (K6)\nđến 0,4\n- Đô thị Trung du (K7)\n\" 0,8\n- Đô thị Đồng bằng (K8)\n\" 1,0\n- Đô thị Ven biển (K9)\n\" 1,1\nCác đô thị du lịch, nghỉ mát (K10) cộng thêm vào hệ số quy định 0,4.\nRiêng đối với nhà nhiều tầng thuộc nhiều chủ khác nhau thì áp dụng hệ số sau để tính giá chuyển quyền sử dụng đất:\nNhà\nHệ số các tầng\n1\n2\n3\n4\n1 tầng (lầu trệt)\n1\n2 tầng (lầu 1)\n0,7\n0,3\n3 tầng (lầu 2)\n0,7\n0,2\n0,1\n4 tầng (lầu 3)\n0,7\n0,15\n0,1\n0,05\nĐối với nhà từ tầng 5 (lầu 4) trở lên không tính giá chuyển quyền sử dụng đất.\nPhương pháp xác định giá chuyển quyền sử dụng đất:\nGcq = Scd x Gđ x H\nGcq là giá chuyển quyền sử dụng đất.\nScđ là diện tích đất chuyển quyền sử dụng.\nGđ là giá chuẩn tối thiểu chuyển quyền sử dụng: 1000đ/m2.\nH là hệ số tính đổi.\nCăn cứ vào bảng giá chuẩn tối thiểu nhà và quyền sử dụng đất tại phụ lục số 1, số 2 (kèm theo). UBND các tỉnh, thành phố ban hành các loại giá nhà, giá chuyển quyền sử dụng đất khác, điều chỉnh các loại cho phù hợp với giá thực tế của địa phương, nhưng không được thấp hơn mức giá chuẩn tối thiểu.\nPHỤ LỤC SỐ 1\nBẢNG MỨC GIÁ CHUẨN TỐI THIỂU NHÀ XÂY DỰNG MỚI\nĐV: 1000đ/m\n2\nCác khu vực\nBiệt thự (hạng)\nNhà (cấp)\nI\nII\nIII\nIV\nI\nII\nIII\nIV\nThành phố Hà Nội\n1.100\n1.200\n1.400\n2.000\n900\n800\n550\n400\nThành phố Hồ Chí Minh\n1.200\n1.500\n1.600\n2.000\n1.000\n900\n550\n400\nCác đô thị cấp II\n1.100\n1.100\n1.200\n2.000\n800\n700\n400\n300\nĐồng bằng Bắc Bộ\n900\n1.100\n1.100\n2.000\n800\n700\n400\n300\nĐồng bằng Nam Bộ\n1.100\n1.200\n1.300\n2.000\n1.000\n900\n450\n300\nTrung du\n1.100\n1.200\n1.300\n2.000\n900\n700\n450\n300\nMiền núi\n1.100\n1.300\n1.200\n2.000\n1.000\n800\n400\n250\nPHỤ LỤC SỐ 2\nBẢNG MỨC GIÁ CHUẨN TỐI THIỂU CHUYỂN QUYỀN SỬ DỤNG ĐẤT\nĐơn vị tính: 1000đ/m\n2\nKhu vực đất\nVùng lãnh thổ\nHạng đất\nTheo cấp đô thị\nI\nII\nIII\nIV\nV\n1\n2\n3\n4\n5\n6\n7\n8\nA\n4.600\n2.600\n1.600\n800\n600\nĐồng bằng\nB\n2.700\n1.950\n1.200\n600\n450\nC\n1.800\n1.300\n800\n400\n300\nD\n900\n710\n560\n280\n210\nTrung tâm\nA\n-\n-\n1.000\n560\n400\nTrung du\nB\n-\n-\n750\n420\n300\nC\n-\n-\n500\n280\n200\nD\n-\n-\n350\n196\n140\nA\n-\n-\n500\n300\n200\nMiền núi\nB\n-\n-\n375\n225\n150\nC\n-\n-\n250\n150\n100\nD\n-\n-\n175\n105\n70\nA\n2.160\n2.000\n1.000\n600\n300\nĐồng bằng\nB\n1.620\n1.500\n750\n450\n225\nC\n1.080\n1.000\n500\n300\n150\nD\nCận Trung tâm\nA\n800\n400\n100\nTrung du\nB\n600\n300\n75\nC\n400\n200\n50\nD\n280\n140\n35\nA\n400\n300\n80\nMiền núi\nB\n300\n225\n60\nC\n200\n150\n40\nD\n140\n105\n28\nA\n900\n600\n600\n400\n200\nĐồng bằng\nB\n670\n450\n450\n300\n150\nC\n450\n300\n300\n200\n100\nD\n300\n250\n200\n140\n70\nVen nội\nA\n400\n300\n60\nTrung du\nB\n300\n225\n45\nC\n200\n150\n30\nD\n140\n100\n25\nA\n300\n200\n40\nMiền núi\nB\n225\n150\n30\nC\n150\n100\n20\nD\n100\n70\n15\nNgoài khu vực đô thị\nA\n140\nB\n100\nC\n40\nD\n15\nPHỤ LỤC 3\nBẢNG PHÂN LOẠI TỔNG HỢP CÁC ĐÔ THỊ VIỆT NAM\nĐô thị loại I\n28. Plây Cu\n59. Kiến An\n1. Hồ Chí Minh\n29. Hoà Bình\n60. Hội An\n2. Hà Nội\n30. Rạch Giá\n61. Lai Châu\nII. Đô thị loại II\n31. Thái Bình\n62. Đồng Hới\n3. Đà Nẵng\n32. Yên Bái\n63. Quảng Trị\n4. Hải Phòng\n33. Tuy Hoà\n64. Hà Tĩnh\n5. Huế\n34. Cao Lãnh\n65. Hà Giang\n6. Cần Thơ\n35. Hải Dương\n66. Lào Cai\n7. Biên Hoà\n36. Châu Đốc\nV. Đô Thị loại V\nIII. Đô thị loại III\n37. Sa Đéc\n67. Vĩnh An\n8. Nha Trang\n38. Tân An\n68. Tam Điệp\n9. Nam Định\n39. Bắc Giang\n69. Phú Thọ\n10. Quy Nhơn\n40. Uông Bí\n70. Đồ Sơn\n11. Vũng Tàu\n41. Trà Vinh\n71. Hà Nam\n12. Long Xuyên\n42. Tam Kỳ\n72. Vị Thanh\n13. Đà Lạt\nIV. Đô thị loại IV\n73. Gò Công\n14. Thái Nguyên\n43. Bến Tre\n74. Sầm Sơn\n15. Vinh\n44. Thủ Dầu Một\n75. Sông Công\n16. Mỹ Tho\n45. Hà Đông\n76. Hưng Yên\n17. Hòn Gai\n46. Đông Hà\n18. Phan Thiết\n47. Quãng Ngãi\n19. Cẩm Phả\n48. Sơn Tây\n20. Buôn Mê Thuột\n49. Tây Ninh\n21. Vĩnh Long\n50. Bắc Ninh\n22. Sóc Trăng\n51. Kon Tum\n23. Thanh Hoá\n52. Sơn La\n24. Cà Mau\n53. Lạng Sơn\n25. Bạc Liêu\n54. Ninh Bình\n26. Việt Trì\n55. Cao Bằng\n27. Phan Rang\n56. Vĩnh Yên\n57. Tuyên Quang\n58. Bỉm Sơn",
  "content_length": 25933,
  "crawled_at": "2025-12-11T17:07:42.249706"
}