{
  "id": "12324",
  "title": "Document 12324",
  "url": "https://vbpl.vn/TW/Pages/vbpq-toanvan.aspx?ItemID=12324",
  "info": {
    "STT": "Hàng hoá, dịch vụ",
    "I": "Hàng hoá",
    "1": "Kinh doanh vũ trường",
    "2": "Kinh doanh mát-xa, ka-ra-ô-kê",
    "3": "Kinh doanh ca-si-nô, trò chơi điện tử có thưởng",
    "4": "Kinh doanh đặt cược",
    "5": "Kinh doanh gôn",
    "6": "Kinh doanh xổ số",
    "7": "Du thuyền",
    "8": "Xăng các loại, nap-ta, chế phẩm tái hợp và các chế phẩm khác để pha chế xăng",
    "9": "Điều hoà nhiệt độ công suất từ 90.000 BTU trở xuống",
    "10": "Bài lá",
    "11": "Vàng mã, hàng mã",
    "II": "Dịch vụ"
  },
  "content": "LUẬT\nThuế tiêu thụ đặc biệt\n___________\nCăn cứ Hiến pháp nước Cộng hoà xã hội chủ nghĩa Việt Nam năm 1992 đã được sửa đổi, bổ sung một số điều theo Nghị quyết số\n51/2001/QH10;\nQuốc hội ban hành Luật thuế tiêu thụ đặc biệt,\nCHƯƠNG I\nNHỮNG QUY ĐỊNH CHUNG\nĐiều 1. Phạm vi điều chỉnh\nLuật này quy định về đối tượng chịu thuế, đối tượng không chịu thuế, người nộp thuế, căn cứ tính thuế, hoàn thuế, khấu trừ thuế và giảm thuế tiêu thụ đặc biệt.\nĐiều 2. Đối tượng chịu thuế\n1. Hàng hóa:\na) Thuốc lá điếu, xì gà và chế phẩm khác từ cây thuốc lá dùng để hút, hít, nhai, ngửi, ngậm;\nb) Rượu;\nc) Bia;\nd) Xe ô tô dưới 24 chỗ, kể cả xe ô tô vừa chở người, vừa chở hàng loại có từ hai hàng ghế trở lên, có thiết kế vách ngăn cố định giữa khoang chở người và khoang chở hàng;\nđ) Xe mô tô hai bánh, xe mô tô ba bánh có dung tích xi lanh trên 125cm\n3\n;\ne) Tàu bay, du thuyền;\ng) Xăng các loại, nap-ta (naphtha), chế phẩm tái hợp (reformade component) và các chế phẩm khác để pha chế xăng;\nh) Điều hoà nhiệt độ công suất từ 90.000 BTU trở xuống;\ni) Bài lá;\nk) Vàng mã, hàng mã.\n2. Dịch vụ:\na) Kinh doanh vũ trường;\nb) Kinh doanh mát-xa (massage), ka-ra-ô-kê (karaoke);\nc) Kinh doanh ca-si-nô (casino); trò chơi điện tử có thưởng bao gồm trò chơi bằng máy giắc-pót (jackpot), máy sờ-lot (slot) và các loại máy tương tự;\nd) Kinh doanh đặt cược;\nđ) Kinh doanh gôn (golf) bao gồm bán thẻ hội viên, vé chơi gôn;\ne) Kinh doanh xổ số.\nĐiều 3. Đối tượng không chịu thuế\nHàng hóa quy định tại khoản 1 Điều 2 của Luật này không thuộc diện chịu thuế tiêu thụ đặc biệt trong các trường hợp sau:\n1. Hàng hóa do cơ sở sản xuất, gia công trực tiếp xuất khẩu hoặc bán, ủy thác cho cơ sở kinh doanh khác để xuất khẩu;\n2. Hàng hóa nhập khẩu bao gồm:\na) Hàng viện trợ nhân đạo, viện trợ không hoàn lại; quà tặng cho cơ quan nhà nước, tổ chức chính trị, tổ chức chính trị - xã hội, tổ chức chính trị xã hội - nghề nghiệp, tổ chức xã hội, tổ chức xã hội - nghề nghiệp, đơn vị vũ trang nhân dân, quà biếu, quà tặng cho cá nhân tại Việt Nam theo mức quy định của Chính phủ;\nb) Hàng hóa vận chuyển quá cảnh hoặc mượn đường qua cửa khẩu, biên giới Việt Nam, hàng hóa chuyển khẩu theo quy định của Chính phủ;\nc) Hàng tạm nhập khẩu, tái xuất khẩu và tạm xuất khẩu, tái nhập khẩu không phải nộp thuế nhập khẩu, thuế xuất khẩu trong thời hạn theo quy định của pháp luật về thuế xuất khẩu, thuế nhập khẩu;\nd) Đồ dùng của tổ chức, cá nhân nước ngoài theo tiêu chuẩn miễn trừ ngoại giao; hàng mang theo người trong tiêu chuẩn hành lý miễn thuế; hàng nhập khẩu để bán miễn thuế theo quy định của pháp luật;\n3. Tàu bay, du thuyền sử dụng cho mục đích kinh doanh vận chuyển hàng hoá, hành khách, khách du lịch;\n4. Xe ô tô cứu thương; xe ô tô chở phạm nhân; xe ô tô tang lễ; xe ô tô thiết kế vừa có chỗ ngồi, vừa có chỗ đứng chở được từ 24 người trở lên; xe ô tô chạy trong khu vui chơi, giải trí, thể thao không đăng ký lưu hành và không tham gia giao thông;\n5. Hàng hoá nhập khẩu từ nước ngoài vào khu phi thuế quan, hàng hoá từ nội địa bán vào khu phi thuế quan và chỉ sử dụng trong khu phi thuế quan, hàng hoá được mua bán giữa các khu phi thuế quan với nhau, trừ xe ô tô chở người dưới 24 chỗ.\nĐiều 4.\nNgười nộp thuế\nNgười\nnộp thuế tiêu thụ đặc biệt là tổ chức, cá nhân sản xuất, nhập khẩu hàng hóa và kinh doanh dịch vụ thuộc đối tượng chịu thuế tiêu thụ đặc biệt.\nTrường hợp tổ chức, cá nhân có hoạt động kinh doanh xuất khẩu mua hàng hoá thuộc diện chịu thuế tiêu thụ đặc biệt của cơ sở sản xuất để xuất khẩu nhưng không xuất khẩu mà tiêu thụ trong nước thì tổ chức, cá nhân có hoạt động kinh doanh xuất khẩu là người nộp thuế tiêu thụ đặc biệt.\nCHƯƠNG II\nCĂN CỨ TÍNH THUẾ\nĐiều 5. Căn cứ tính thuế\nCăn cứ tính thuế tiêu thụ đặc biệt là giá tính thuế của hàng hóa, dịch vụ chịu thuế và thuế suất. Số thuế tiêu thụ đặc biệt phải nộp bằng giá tính thuế tiêu thụ đặc biệt nhân với thuế suất thuế tiêu thụ đặc biệt.\nĐiều 6. Giá tính thuế\nGiá tính thuế tiêu thụ đặc biệt đối với hàng hoá, dịch vụ là giá bán ra, giá cung ứng dịch vụ chưa có thuế tiêu thụ đặc biệt và chưa có thuế giá trị gia tăng được quy định như sau:\n1. Đối với hàng hóa sản xuất trong nước là giá do cơ sở sản xuất bán ra;\n2. Đối với hàng hóa nhập khẩu là giá tính thuế nhập khẩu cộng với thuế nhập khẩu. Trường hợp hàng hóa nhập khẩu được miễn, giảm thuế nhập khẩu thì giá tính thuế không bao gồm số thuế nhập khẩu được miễn, giảm;\n3. Đối với hàng hóa gia công là giá tính thuế của hàng hóa bán ra của cơ sở giao gia công hoặc giá bán của sản phẩm cùng loại hoặc tương đương tại cùng thời điểm bán hàng;\n4. Đối với hàng hóa bán theo phương thức trả góp, trả chậm là giá bán theo phương thức bán trả tiền một lần của hàng hóa đó không bao gồm khoản lãi trả góp, lãi trả chậm;\n5. Đối với dịch vụ là giá cung ứng dịch vụ của cơ sở kinh doanh. Giá cung ứng dịch vụ đối với một số trường hợp được quy định như sau:\na) Đối với kinh doanh gôn là giá bán thẻ hội viên, giá bán vé chơi gôn bao gồm cả tiền phí chơi gôn và tiền ký quỹ (nếu có);\nb) Đối với kinh doanh ca-si-nô, trò chơi điện tử có thưởng, kinh doanh đặt cược là doanh thu từ hoạt động này trừ số tiền đã trả thưởng cho khách;\nc) Đối với kinh doanh vũ trường, mát-xa, ka-ra-ô-kê là doanh thu của các hoạt động kinh doanh trong vũ trường, cơ sở kinh doanh mát-xa, ka-ra-ô-kê;\n6. Đối với hàng hóa, dịch vụ dùng để trao đổi hoặc tiêu dùng nội bộ, biếu, tặng cho là giá tính thuế tiêu thụ đặc biệt của hàng hóa, dịch vụ cùng loại hoặc tương đương tại thời điểm phát sinh các hoạt động này.\nGiá tính thuế tiêu thụ đặc biệt đối với hàng hóa, dịch vụ quy định tại Điều này bao gồm cả khoản thu thêm, được thu (nếu có) mà cơ sở kinh doanh được hưởng.\nGiá tính thuế được tính bằng Đồng Việt Nam. Trường hợp người nộp thuế có doanh thu bằng ngoại tệ thì phải quy đổi ngoại tệ ra Đồng Việt Nam theo tỷ giá giao dịch bình quân trên thị trường ngoại tệ liên ngân hàng do Ngân hàng nhà nước Việt Nam công bố tại thời điểm phát sinh doanh thu để xác định giá tính thuế.\nChính phủ quy định cụ thể Điều này.\nĐiều 7. Thuế suất\nThuế suất thuế tiêu thụ đặc biệt đối với hàng hoá, dịch vụ được quy định theo Biểu thuế tiêu thụ đặc biệt sau đây:\nBIỂU THUẾ TIÊU THỤ ĐẶC BIỆT\nSTT\nHàng hoá, dịch vụ\nThuế suất (%)\nI\nHàng hoá\n1\nThuốc lá điếu, xì gà và các chế phẩm khác từ cây thuốc lá\n65\n2\nRượu\na) Rượu từ 20 độ trở lên\nTừ ngày 01 tháng 01 năm 2010 đến hết ngày 31 tháng 12 năm 2012\n45\nTừ ngày 01 tháng 01 năm 2013\n50\nb) Rượu dưới 20 độ\n25\n3\nBia\nTừ ngày 01 tháng 01 năm 2010 đến hết ngày 31 tháng 12 năm 2012\n45\nTừ ngày 01 tháng 01 năm 2013\n50\n4\nXe ô tô dưới 24 chỗ\na) Xe ô tô chở người từ 9 chỗ trở xuống, trừ loại quy định tại điểm 4đ, 4e và 4g Điều này\nLoại có dung tích xi lanh từ 2.000 cm\n3\ntrở xuống\n45\nLoại có dung tích xi lanh trên 2.000 cm\n3\nđến 3.000 cm\n3\n50\nLoại có dung tích xi lanh trên 3.000 cm\n3\n60\nb) Xe ô tô chở người từ 10 đến dưới 16 chỗ, trừ loại quy định tại điểm 4đ, 4e và 4g Điều này\n30\nc) Xe ô tô chở người từ 16 đến dưới 24 chỗ, trừ loại quy định tại điểm 4đ, 4e và 4g Điều này\n15\nd) Xe ô tô vừa chở người, vừa chở hàng, trừ loại quy định tại điểm 4đ, 4e và 4g Điều này\n15\nđ) Xe ô tô chạy bằng xăng kết hợp năng lượng điện, năng lượng sinh học, trong đó tỷ trọng xăng sử dụng không quá 70% số năng lượng sử dụng.\nBằng 70% mức thuế suất áp dụng cho xe cùng loại quy định tại điểm 4a, 4b, 4c và 4d Điều này\ne) Xe ô tô chạy bằng năng lượng sinh học\nBằng 50% mức thuế suất áp dụng cho xe cùng loại quy định tại điểm 4a, 4b, 4c và 4d Điều này\ng) Xe ô tô chạy bằng điện\nLoại chở người từ 9 chỗ trở xuống\n25\nLoại chở người từ 10 đến dưới 16 chỗ\n15\nLoại chở người từ 16 đến dưới 24 chỗ\n10\nLoại thiết kế vừa chở người, vừa chở hàng\n10\n5\nXe mô tô hai bánh, xe mô tô ba bánh có dung tích xi lanh trên 125cm\n3\n20\n6\nTàu bay\n30\n7\nDu thuyền\n30\n8\nXăng các loại, nap-ta, chế phẩm tái hợp và các chế phẩm khác để pha chế xăng\n10\n9\nĐiều hoà nhiệt độ công suất từ 90.000 BTU trở xuống\n10\n10\nBài lá\n40\n11\nVàng mã, hàng mã\n70\nII\nDịch vụ\n1\nKinh doanh vũ trường\n40\n2\nKinh doanh mát-xa, ka-ra-ô-kê\n30\n3\nKinh doanh ca-si-nô, trò chơi điện tử có thưởng\n30\n4\nKinh doanh đặt cược\n30\n5\nKinh doanh gôn\n20\n6\nKinh doanh xổ số\n15\nCHƯƠNG III\nHOÀN THUẾ, KHẤU TRỪ THUẾ, GIẢM THUẾ\nĐiều 8. Hoàn thuế, khấu trừ thuế\n1. Người nộp thuế tiêu thụ đặc biệt được hoàn thuế đã nộp trong các trường hợp sau:\na) Hàng tạm nhập khẩu, tái xuất khẩu;\nb) Hàng hóa là nguyên liệu nhập khẩu để sản xuất, gia công hàng xuất khẩu\n;\nc) Quyết toán thuế khi sáp nhập, hợp nhất, chia, tách, giải thể, phá sản, chuyển đổi sở hữu, chuyển đổi doanh nghiệp, chấm dứt hoạt động có số thuế nộp thừa;\nd) Có quyết định hoàn thuế của cơ quan có thẩm quyền theo quy định của pháp luật và trường hợp hoàn thuế tiêu thụ đặc biệt theo điều ước quốc tế mà Cộng hòa xã hội chủ nghĩa Việt Nam là thành viên.\nViệc hoàn thuế tiêu thụ đặc biệt theo quy định tại điểm a và điểm b khoản này chỉ thực hiện đối với hàng hoá thực tế xuất khẩu.\n2. Người nộp thuế sản xuất hàng hóa thuộc đối tượng chịu thuế tiêu thụ đặc biệt bằng nguyên liệu đã nộp thuế tiêu thụ đặc biệt nếu có chứng từ hợp pháp thì được khấu trừ số thuế đã nộp đối với nguyên liệu khi xác định số thuế tiêu thụ đặc biệt phải nộp ở khâu sản xuất.\nChính phủ quy định cụ thể Điều này.\nĐiều 9. Giảm thuế\nNgười nộp thuế sản xuất hàng hoá thuộc diện chịu thuế tiêu thụ đặc biệt gặp khó khăn do thiên tai, tai nạn bất ngờ được giảm thuế.\nMức giảm thuế được xác định trên cơ sở tổn thất thực tế do thiên tai, tai nạn bất ngờ gây ra nhưng không quá 30% số thuế phải nộp của năm xảy ra thiệt hại và không vượt quá giá trị tài sản bị thiệt hại sau khi được bồi thường (nếu có).\nCHƯƠNG IV\nĐIỀU KHOẢN THI HÀNH\nĐiều 10. Hiệu lực thi hành\n1. Luật này có hiệu lực thi hành từ ngày 01 tháng 4 năm 2009; các quy định đối với mặt hàng rượu và bia có hiệu lực thi hành từ ngày 01 tháng 01 năm 2010.\n2. Bãi bỏ các quy định tại Luật thuế tiêu thụ đặc biệt số\n05/1998/QH10;\nLuật sửa đổi, bổ sung một số điều của Luật thuế tiêu thụ đặc biệt số\n08/2003/QH11;\nĐiều 1 của Luật sửa đổi, bổ sung một số điều của Luật thuế tiêu thụ đặc biệt và Luật thuế giá trị gia tăng số\n57/2005/QH11,\ntrừ các quy định đối với mặt hàng rượu và bia tiếp tục có hiệu lực thi hành đến hết ngày 31 tháng 12 năm 2009.\nĐiều 11. Hướng dẫn thi hành\nChính phủ quy định chi tiết, hướng dẫn thi hành các điều, khoản được giao trong Luật này; hướng dẫn những nội dung cần thiết khác của Luật này để đáp ứng yêu cầu quản lý nhà nước.\nLuật này đã được Quốc hội nước Cộng hòa xã hội chủ nghĩa Việt Nam khóa XII, kỳ họp thứ 4 thông qua ngày 14 tháng 11 năm 2008./.",
  "content_length": 10460,
  "crawled_at": "2025-12-11T17:09:03.836393"
}