{
  "id": "152571",
  "title": "Document 152571",
  "url": "https://vbpl.vn/TW/Pages/vbpq-toanvan.aspx?ItemID=152571",
  "info": {
    "1/01/clip_image001.png\"width=\"89\" />QUỐC HỘILuật số01/2021/QH15": "CỘNG HÒA XÃ HỘI CHỦ NGHĨA VIỆT NAM1/01/clip_image002.png\"width=\"276\" />Độc lập - Tự do - Hạnh phúc",
    "Sốthứ tự": "Mã số",
    "1": "0101",
    "2": "0102",
    "3": "0103",
    "4": "0104",
    "5": "0105",
    "6": "0106",
    "7": "0107",
    "8": "0108",
    "9": "0109",
    "10": "0110",
    "11": "0111",
    "12": "0112",
    "13": "0113",
    "14": "0114",
    "15": "0115",
    "16": "0201",
    "17": "0202",
    "18": "0203",
    "19": "0204",
    "20": "0205",
    "21": "0206",
    "22": "0207",
    "23": "0208",
    "24": "0209",
    "25": "0210",
    "26": "0211",
    "27": "0212",
    "28": "0213",
    "29": "0301",
    "30": "0302",
    "31": "0303",
    "32": "0304",
    "33": "0305",
    "34": "0306",
    "35": "0401",
    "36": "0402",
    "37": "0403",
    "38": "0404",
    "39": "0405",
    "40": "0406",
    "41": "0407",
    "42": "0408",
    "43": "0409",
    "44": "0501",
    "45": "0502",
    "46": "0503",
    "47": "0504",
    "48": "0505",
    "49": "0506",
    "50": "0507",
    "51": "0508",
    "52": "0509",
    "53": "0510",
    "54": "0511",
    "55": "0512",
    "56": "0513",
    "57": "0514",
    "58": "0515",
    "59": "0516",
    "60": "0517",
    "61": "0601",
    "62": "0602",
    "63": "0603",
    "64": "0604",
    "65": "0605",
    "66": "0606",
    "67": "0607",
    "68": "0608",
    "69": "0609",
    "70": "0610",
    "71": "0701",
    "72": "0702",
    "73": "0703",
    "74": "0704",
    "75": "0705",
    "76": "0706",
    "77": "0707",
    "78": "0708",
    "79": "0709",
    "80": "0710",
    "81": "0711",
    "82": "0712",
    "83": "0713",
    "84": "0714",
    "85": "0715",
    "86": "0716",
    "87": "0717",
    "88": "0718",
    "89": "0719",
    "90": "0720",
    "91": "0721",
    "92": "0722",
    "93": "0723",
    "94": "0724",
    "95": "0801",
    "96": "0802",
    "97": "0803",
    "98": "0804",
    "99": "0805",
    "100": "0806",
    "101": "0807",
    "102": "0808",
    "103": "0809",
    "104": "0810",
    "105": "0811",
    "106": "0812",
    "107": "0813",
    "108": "0814",
    "109": "0901",
    "110": "0902",
    "111": "0903",
    "112": "0904",
    "113": "0905",
    "114": "0906",
    "115": "0907",
    "116": "0908",
    "117": "1001",
    "118": "1002",
    "119": "1003",
    "120": "1004",
    "121": "1005",
    "122": "1006",
    "123": "1007",
    "124": "1008",
    "125": "1009",
    "126": "1010",
    "127": "1101",
    "128": "1102",
    "129": "1103",
    "130": "1104",
    "131": "1105",
    "132": "1106",
    "133": "1107",
    "134": "1108",
    "135": "1109",
    "136": "1201",
    "137": "1202",
    "138": "1203",
    "139": "1204",
    "140": "1205",
    "141": "1206",
    "142": "1207",
    "143": "1208",
    "144": "1209",
    "145": "1210",
    "146": "1301",
    "147": "1302",
    "148": "1303",
    "149": "1304",
    "150": "1305",
    "151": "1306",
    "152": "1307",
    "153": "1308",
    "154": "1309",
    "155": "1310",
    "156": "1311",
    "157": "1312",
    "158": "1313",
    "159": "1314",
    "160": "1315",
    "161": "1316",
    "162": "1317",
    "163": "1318",
    "164": "1319",
    "165": "1320",
    "166": "1321",
    "167": "1401",
    "168": "1402",
    "169": "1403",
    "170": "1404",
    "171": "1405",
    "172": "1406",
    "173": "1501",
    "174": "1502",
    "175": "1503",
    "176": "1504",
    "177": "1505",
    "178": "1506",
    "179": "1507",
    "180": "1601",
    "181": "1602",
    "182": "1603",
    "183": "1604",
    "184": "1605",
    "185": "1606",
    "186": "1607",
    "187": "1608",
    "188": "1609",
    "189": "1610",
    "190": "1701",
    "191": "1702",
    "192": "1703",
    "193": "1704",
    "194": "1705",
    "195": "1706",
    "196": "1707",
    "197": "1708",
    "198": "1709",
    "199": "1801",
    "200": "1802",
    "201": "1803",
    "202": "1804",
    "203": "1805",
    "204": "1806",
    "205": "1807",
    "206": "1808",
    "207": "1809",
    "208": "1810",
    "209": "1901",
    "210": "1902",
    "211": "1903",
    "212": "1904",
    "213": "1905",
    "214": "2001",
    "215": "2002",
    "216": "2003",
    "217": "2004",
    "218": "2005",
    "219": "2006",
    "220": "2101",
    "221": "2102",
    "222": "2103",
    "223": "2104",
    "224": "2105",
    "225": "2106",
    "226": "2107",
    "227": "2108",
    "228": "2109",
    "229": "2110",
    "230": "2111"
  },
  "content": "1/01/clip_image001.png\"\nwidth=\"89\" />\nQUỐC HỘI\nLuật số:\n01/2021/QH15\nCỘNG HÒA XÃ HỘI CHỦ NGHĨA VIỆT NAM\n1/01/clip_image002.png\"\nwidth=\"276\" />\nĐộc lập - Tự do - Hạnh phúc\nLUẬT\nSỬA ĐỔI, BỔ SUNG MỘT SỐ ĐIỀU VÀ PHỤ LỤC DANH MỤC\nCHỈ TIÊU THỐNG KÊ QUỐC GIA CỦA LUẬT THỐNG KÊ\nCăn cứ Hiến pháp nước Cộng hoà xã hội chủ nghĩa Việt Nam;\nQuốc hội ban hành Luật\nsửa đổi, bổ sung một số điều và Phụ lục Danh mục chỉ tiêu thống kê quốc gia của Luật\nThống kê số\n89/2015/QH13.\nĐiều\n1. Sửa đổi, bổ sung một số điều và Phụ lục Danh mục chỉ tiêu thống kê quốc gia của Luật Thống kê\n1. Sửa đổi, bổ sung khoản 6 Điều 17 như sau:\n“6. Bộ trưởng Bộ Kế hoạch và Đầu tư chủ trì, phối hợp với bộ, ngành và địa phương thực hiện các nhiệm vụ sau đây:\na) Xây dựng, trình Chính phủ ban hành nội dung chỉ tiêu thống kê thuộc hệ thống chỉ tiêu thống kê quốc gia và quy trình biên soạn chỉ tiêu tổng sản phẩm trong nước, chỉ tiêu tổng sản phẩm trên địa bàn tỉnh, thành phố trực thuộc trung ương;\nb) Hướng dẫn, kiểm tra tình hình và báo cáo kết quả thực hiện hệ thống chỉ tiêu thống kê quốc gia;\nc) Định kỳ 05 năm, rà soát quy mô tổng sản phẩm trong nước báo cáo Chính phủ để trình Quốc hội xem xét, quyết định về việc đánh giá lại quy mô tổng sản phẩm trong nước.”.\n2. Sửa đổi, bổ sung điểm d khoản 2 Điều 48 như sau:\n“d) Người đứng đầu cơ quan thống kê cấp tỉnh công bố thông tin thống kê thuộc hệ thống chỉ tiêu thống kê cấp tỉnh, cấp huyện, cấp xã; đối với thông tin thống kê của chỉ tiêu thống kê cấp tỉnh là phân tổ của chỉ tiêu thống kê quốc gia phải thống nhất về chuyên môn, nghiệp vụ với cơ quan thống kê trung ương trước khi công bố.”.\n3. Thay thế Phụ lục Danh mục chỉ tiêu thống kê quốc gia ban hành kèm theo Luật Thống kê số\n89/2015/QH13\nbằng Phụ lục Danh mục chỉ tiêu thống kê quốc gia ban hành kèm theo Luật này.\nĐiều\n2. Điều khoản thi hành\n1. Luật này có hiệu lực thi hành từ ngày 01 tháng 01 năm 2022.\n2. Chương trình điều tra thống kê quốc gia, chế độ báo cáo thống kê cấp quốc gia phục vụ biên soạn các chỉ tiêu thống kê quy định tại Phụ lục Danh mục chỉ tiêu thống kê quốc gia ban hành kèm theo Luật Thống kê số\n89/2015/QH13\nđược tiếp tục thực hiện đến hết ngày 31 tháng 12 năm 2022.\nLuật này được Quốc hội nước Cộng hoà xã hội chủ nghĩa Việt Nam khoá XV, kỳ họp thứ\n2\nthông qua ngày\n12\ntháng\n11\nnăm\n2021.\nCHỦ TỊCH QUỐC HỘI\n(đã ký)\nVương Đình Huệ\nPHỤ LỤC\nDANH MỤC CHỈ TIÊU THỐNG KÊ QUỐC GIA\n(Ban hành kèm theo Luật số\n01/2021/QH15\nsửa đổi, bổ sung\nmột số điều và Phụ lục Danh mục chỉ tiêu thống kê quốc gia của\nLuật\nThống kê)\nSố\nthứ tự\nMã số\nNhóm, tên chỉ tiêu\n01. Đất đai, dân số\n1\n0101\nDiện tích và cơ cấu đất\n2\n0102\nDân số, mật độ dân số\n3\n0103\nTỷ số giới tính khi sinh\n4\n0104\nTỷ suất sinh thô\n5\n0105\nTổng tỷ suất sinh\n6\n0106\nTỷ suất chết thô\n7\n0107\nTỷ lệ tăng dân số\n8\n0108\nTỷ suất nhập cư, xuất cư, tỷ suất di cư thuần\n9\n0109\nTuổi thọ trung bình tính từ lúc sinh\n10\n0110\nTỷ lệ người khuyết tật\n11\n0111\nSố cuộc kết hôn và tuổi kết hôn trung bình lần đầu\n12\n0112\nSố vụ ly hôn và tuổi ly hôn trung bình\n13\n0113\nTỷ lệ trẻ em dưới 05 tuổi đã được đăng ký khai sinh\n14\n0114\nSố trường hợp tử vong được đăng ký khai tử\n15\n0115\nTỷ lệ đô thị hóa\n02. Lao động, việc làm và bình đẳng giới\n16\n0201\nLực lượng lao động\n17\n0202\nSố lao động có việc làm trong nền kinh tế\n18\n0203\nTỷ lệ lao động đã qua đào tạo\n19\n0204\nTỷ lệ thất nghiệp\n20\n0205\nTỷ lệ thiếu việc làm\n21\n0206\nTỷ lệ lao động có việc làm phi chính thức\n22\n0207\nTỷ lệ người từ 05-17 tuổi tham gia lao động\n23\n0208\nNăng suất lao động\n24\n0209\nThu nhập bình quân một lao động đang làm việc\n25\n0210\nTỷ lệ nữ tham gia cấp ủy đảng\n26\n0211\nTỷ lệ nữ đại biểu Quốc hội\n27\n0212\nTỷ lệ nữ đại biểu Hội đồng nhân dân\n28\n0213\nTỷ lệ cơ quan quản lý nhà nước, chính quyền địa phương các cấp có lãnh đạo chủ chốt là nữ\n03. Doanh nghiệp, cơ sở kinh tế, hành chính, sự nghiệp\n29\n0301\nSố cơ sở, số lao động trong các cơ sở kinh tế\n30\n0302\nSố cơ sở, số lao động trong các cơ sở hành chính,\nsự nghiệp\n31\n0303\nSố hộ, số lao động kinh tế cá thể tham gia hoạt động nông nghiệp, lâm nghiệp và thủy sản\n32\n0304\nSố doanh nghiệp, số lao động, nguồn vốn, tài sản, doanh thu thuần, thu nhập của người lao động, lợi nhuận trước thuế của doanh nghiệp\n33\n0305\nTrang bị tài sản cố định bình quân một lao động của doanh nghiệp\n34\n0306\nTỷ suất lợi nhuận trước thuế của doanh nghiệp\n04. Đầu tư và xây dựng\n35\n0401\nVốn đầu tư thực hiện toàn xã hội\n36\n0402\nTỷ lệ vốn đầu tư thực hiện toàn xã hội so với tổng sản phẩm trong nước\n37\n0403\nHiệu quả sử dụng vốn đầu tư (ICOR)\n38\n0404\nNăng lực mới tăng chủ yếu của nền kinh tế\n39\n0405\nDiện tích sàn xây dựng nhà ở hoàn thành\n40\n0406\nSố lượng nhà ở, tổng diện tích nhà ở hiện có và sử dụng\n41\n0407\nDiện tích nhà ở bình quân đầu người\n42\n0408\nTổng diện tích nhà ở theo dự án hoàn thành trong năm\n43\n0409\nTổng số nhà ở và tổng diện tích nhà ở xã hội hoàn thành trong năm\n05. Tài khoản quốc gia\n44\n0501\nTổng sản phẩm trong nước (GDP)\n45\n0502\nCơ cấu tổng sản phẩm trong nước\n46\n0503\nTốc độ tăng tổng sản phẩm trong nước\n47\n0504\nTổng sản phẩm trong nước bình quân đầu người\n48\n0505\nTích lũy tài sản\n49\n0506\nTiêu dùng cuối cùng\n50\n0507\nThu nhập quốc gia (GNI)\n51\n0508\nTỷ lệ thu nhập quốc gia so với tổng sản phẩm trong nước\n52\n0509\nThu nhập quốc gia khả dụng (NDI)\n53\n0510\nTỷ lệ tiết kiệm so với tổng sản phẩm trong nước\n54\n0511\nTỷ lệ tiết kiệm so với tích lũy tài sản\n55\n0512\nMức tiêu hao và tăng/giảm mức tiêu hao năng lượng cho sản xuất so với tổng sản phẩm trong nước\n56\n0513\nTốc độ tăng năng suất các nhân tố tổng hợp (TFP)\n57\n0514\nTỷ trọng đóng góp của các yếu tố vốn, lao động, năng suất các nhân tố tổng hợp vào tốc độ tăng trưởng chung\n58\n0515\nTỷ trọng giá trị tăng thêm của dịch vụ logistics trong tổng sản phẩm trong nước\n59\n0516\nChi phí logistics so với tổng sản phẩm trong nước\n60\n0517\nTỷ trọng giá trị tăng thêm của kinh tế số trong tổng sản phẩm trong nước\n06. Tài chính công\n61\n0601\nThu ngân sách nhà nước và cơ cấu thu\n62\n0602\nTỷ lệ thu ngân sách nhà nước so với tổng sản phẩm trong nước\n63\n0603\nTỷ lệ thu từ thuế, phí so với tổng sản phẩm trong nước\n64\n0604\nChi ngân sách nhà nước và cơ cấu chi\n65\n0605\nTỷ lệ chi ngân sách nhà nước so với tổng sản phẩm trong nước\n66\n0606\nBội chi ngân sách nhà nước\n67\n0607\nTỷ lệ bội chi ngân sách nhà nước so với tổng sản phẩm trong nước\n68\n0608\nDư nợ của Chính phủ\n69\n0609\nDư nợ nước ngoài của quốc gia\n70\n0610\nDư nợ công\n07. Tiền tệ, bảo hiểm và chứng khoán\n71\n0701\nTổng phương tiện thanh toán\n72\n0702\nTỷ lệ tổng phương tiện thanh toán so với tổng sản phẩm trong nước\n73\n0703\nTốc độ tăng tổng phương tiện thanh toán\n74\n0704\nSố dư huy động vốn của các tổ chức tín dụng, chi nhánh ngân hàng nước ngoài\n75\n0705\nDư nợ tín dụng của các tổ chức tín dụng, chi nhánh ngân hàng nước ngoài\n76\n0706\nTốc độ tăng dư nợ tín dụng của các tổ chức tín dụng, chi nhánh ngân hàng nước ngoài\n77\n0707\nTỷ lệ người từ 15 tuổi trở lên có tài khoản giao dịch tại ngân hàng hoặc các tổ chức được phép khác\n78\n0708\nLãi suất\n79\n0709\nCán cân thanh toán quốc tế\n80\n0710\nTỷ lệ cán cân vãng lai so với tổng sản phẩm trong nước\n81\n0711\nTỷ giá của Đồng Việt Nam (VND) với Đô la Mỹ (USD)\n82\n0712\nTổng thu phí, chi trả bảo hiểm\n83\n0713\nTỷ lệ người tham gia bảo hiểm xã hội\n84\n0714\nTỷ lệ người tham gia bảo hiểm y tế\n85\n0715\nTỷ lệ người tham gia bảo hiểm thất nghiệp\n86\n0716\nSố người được hưởng bảo hiểm xã hội, bảo hiểm y tế, bảo hiểm thất nghiệp\n87\n0717\nThu, chi quỹ bảo hiểm xã hội, bảo hiểm y tế, bảo hiểm thất nghiệp\n88\n0718\nGiá trị vốn hóa thị trường cổ phiếu\n89\n0719\nTỷ lệ vốn hóa thị trường cổ phiếu so với tổng sản phẩm trong nước\n90\n0720\nTốc độ tăng giá trị vốn hóa thị trường cổ phiếu\n91\n0721\nGiá trị huy động vốn qua phát hành cổ phiếu trên thị trường chứng khoán\n92\n0722\nQuy mô thị trường trái phiếu so với tổng sản phẩm trong nước\n93\n0723\nTốc độ tăng quy mô thị trường trái phiếu\n94\n0724\nTổng giá trị phát hành trái phiếu\n08. Nông nghiệp, lâm nghiệp và thủy sản\n95\n0801\nDiện tích cây hằng năm\n96\n0802\nDiện tích cây lâu năm\n97\n0803\nNăng suất một số loại cây trồng chủ yếu\n98\n0804\nSản lượng một số loại cây trồng chủ yếu\n99\n0805\nSố gia súc, gia cầm và động vật khác trong chăn nuôi\n100\n0806\nSản lượng một số sản phẩm chăn nuôi chủ yếu\n101\n0807\nDiện tích rừng trồng mới tập trung\n102\n0808\nSản lượng gỗ và lâm sản ngoài gỗ\n103\n0809\nDiện tích thu hoạch thủy sản\n104\n0810\nSản lượng thủy sản\n105\n0811\nSố lượng tàu khai thác thủy sản biển có động cơ\n106\n0812\nCân đối một số nông sản chủ yếu\n107\n0813\nTỷ lệ mất an ninh lương thực\n108\n0814\nTỷ lệ diện tích đất sản xuất nông nghiệp đạt hiệu quả và bền vững\n09. Công nghiệp\n109\n0901\nChỉ số sản xuất công nghiệp\n110\n0902\nSản lượng một số sản phẩm công nghiệp chủ yếu\n111\n0903\nTỷ trọng giá trị xuất khẩu ngành công nghiệp công nghệ cao trong tổng giá trị ngành công nghiệp công nghệ cao\n112\n0904\nGiá trị tăng thêm ngành công nghiệp chế biến, chế tạo bình quân đầu người theo sức mua tương đương\n113\n0905\nChỉ số tiêu thụ sản phẩm công nghiệp chế biến, chế tạo\n114\n0906\nChỉ số tồn kho sản phẩm công nghiệp chế biến, chế tạo\n115\n0907\nNăng lực sản xuất sản phẩm công nghiệp\n116\n0908\nCân đối một số năng lượng chủ yếu\n10. Thương mại, dịch vụ\n117\n1001\nDoanh thu bán lẻ hàng hoá\n118\n1002\nDoanh thu dịch vụ lưu trú và ăn uống\n119\n1003\nDoanh thu dịch vụ kinh doanh bất động sản\n120\n1004\nDoanh thu dịch vụ khác\n121\n1005\nSố lượng chợ, siêu thị, trung tâm thương mại\n122\n1006\nTrị giá hàng hóa xuất khẩu, nhập khẩu\n123\n1007\nMặt hàng xuất khẩu, nhập khẩu\n124\n1008\nCán cân thương mại hàng hóa\n125\n1009\nTrị giá dịch vụ xuất khẩu, nhập khẩu\n126\n1010\nCán cân thương mại dịch vụ\n11. Chỉ số giá\n127\n1101\nChỉ số giá tiêu dùng (CPI), chỉ số giá vàng, chỉ số giá Đô la Mỹ\n128\n1102\nChỉ số lạm phát cơ bản\n129\n1103\nChỉ số giá sinh hoạt theo không gian\n130\n1104\nChỉ số giá nguyên liệu, nhiên liệu, vật liệu dùng cho sản xuất\n131\n1105\nChỉ số giá sản xuất nông nghiệp, lâm nghiệp, thủy sản, công nghiệp, xây dựng và dịch vụ\n132\n1106\nChỉ số giá bất động sản\n133\n1107\nChỉ số giá tiền lương\n134\n1108\nChỉ số giá xuất khẩu, nhập khẩu\n135\n1109\nTỷ giá thương mại\n12. Giao thông vận tải\n136\n1201\nDoanh thu vận tải, kho bãi và dịch vụ hỗ trợ vận tải\n137\n1202\nSố lượt hành khách vận chuyển và luân chuyển\n138\n1203\nKhối lượng hàng hóa vận chuyển và luân chuyển\n139\n1204\nKhối lượng hàng hóa thông qua cảng\n140\n1205\nSố lượng, năng lực bốc xếp hiện có và mới tăng của cảng thủy nội địa\n141\n1206\nSố lượng, năng lực khai thác hiện có và mới tăng của cảng hàng không\n142\n1207\nSố lượng, năng lực bốc xếp hiện có và mới tăng của cảng biển\n143\n1208\nChiều dài đường sắt hiện có và năng lực mới tăng\n144\n1209\nChiều dài đường cao tốc\n145\n1210\nChiều dài đường quốc lộ\n13. Công nghệ thông tin, bưu chính, viễn thông và truyền thông\n146\n1301\nDoanh thu dịch vụ bưu chính\n147\n1302\nSản lượng dịch vụ bưu chính\n148\n1303\nDoanh thu dịch vụ viễn thông\n149\n1304\nSố lượng thuê bao điện thoại\n150\n1305\nTỷ lệ người sử dụng điện thoại di động\n151\n1306\nTỷ lệ người sử dụng Internet\n152\n1307\nSố lượng thuê bao truy nhập Internet băng rộng\n153\n1308\nTỷ lệ hộ gia đình có kết nối Internet\n154\n1309\nSố thương nhân có giao dịch thương mại điện tử\n155\n1310\nDung lượng băng thông Internet quốc tế\n156\n1311\nDoanh thu dịch vụ công nghệ thông tin\n157\n1312\nDoanh thu dịch vụ nền tảng số và kinh doanh trực tuyến\n158\n1313\nTỷ lệ hộ gia đình có máy tính\n159\n1314\nTỷ lệ dân số được phủ sóng bởi mạng di động\n160\n1315\nLưu lượng Internet băng rộng\n161\n1316\nTổng số chứng thư số đang hoạt động\n162\n1317\nTỷ lệ người dân biết kỹ năng về công nghệ thông tin và truyền thông\n163\n1318\nTỷ lệ người dân có sử dụng dịch vụ công trực tuyến\n164\n1319\nSố dịch vụ hành chính công có phát sinh hồ sơ trực tuyến\n165\n1320\nTỷ lệ người dân tham gia mạng xã hội\n166\n1321\nChi cho chuyển đổi số\n14. Khoa học và công nghệ\n167\n1401\nSố tổ chức khoa học và công nghệ\n168\n1402\nSố người trong các tổ chức khoa học và công nghệ\n169\n1403\nSố người hoạt động nghiên cứu khoa học và phát triển công nghệ\n170\n1404\nSố sáng chế được cấp văn bằng bảo hộ\n171\n1405\nTỷ lệ chi đổi mới công nghệ so với tổng vốn cố định của doanh nghiệp\n172\n1406\nChi cho nghiên cứu khoa học và phát triển công nghệ\n15. Giáo dục\n173\n1501\nSố học sinh phổ thông bình quân một giáo viên\n174\n1502\nSố học sinh phổ thông bình quân một lớp học\n175\n1503\nTỷ lệ học sinh đi học phổ thông\n176\n1504\nTỷ lệ phòng học kiên cố\n177\n1505\nSố trường học các cấp\n178\n1506\nTỷ lệ phân luồng học sinh tốt nghiệp trung học cơ sở, trung học phổ thông vào học giáo dục nghề nghiệp\n179\n1507\nSố sinh viên đại học trên 10.000 dân\n16. Y tế và chăm sóc sức khỏe\n180\n1601\nSố bác sĩ trên 10.000 dân\n181\n1602\nSố giường bệnh trên 10.000 dân\n182\n1603\nTỷ số tử vong mẹ trên 100.000 trẻ đẻ sống\n183\n1604\nTỷ suất chết của trẻ em dưới 01 tuổi\n184\n1605\nTỷ suất chết của trẻ em dưới 05 tuổi\n185\n1606\nTỷ lệ trẻ em dưới 01 tuổi được tiêm chủng đầy đủ các loại vắc xin\n186\n1607\nTỷ lệ trẻ em dưới 05 tuổi suy dinh dưỡng\n187\n1608\nSố ca hiện nhiễm HIV được phát hiện trên 100.000 dân\n188\n1609\nSố ca tử vong do HIV/AIDS được báo cáo hàng năm trên 100.000 dân\n189\n1610\nTỷ lệ cơ sở khám bệnh, chữa bệnh có triển khai tư vấn khám, chữa bệnh từ xa\n17. Văn hóa, thể thao và du lịch\n190\n1701\nSố di sản văn hóa cấp quốc gia\n191\n1702\nSố huy chương trong các kỳ thi đấu quốc tế\n192\n1703\nDoanh thu dịch vụ du lịch lữ hành\n193\n1704\nSố lượt người nước ngoài nhập cảnh Việt Nam\n194\n1705\nSố lượt công dân Việt Nam xuất cảnh\n195\n1706\nSố lượt khách du lịch nội địa\n196\n1707\nSố lượt khách du lịch quốc tế đến Việt Nam\n197\n1708\nChi tiêu của khách quốc tế đến Việt Nam\n198\n1709\nChi tiêu của khách du lịch nội địa\n18. Mức sống dân cư\n199\n1801\nChỉ số phát triển con người (HDI)\n200\n1802\nTỷ lệ nghèo đa chiều\n201\n1803\nTỷ lệ trẻ em nghèo đa chiều\n202\n1804\nThu nhập bình quân đầu người 01 tháng\n203\n1805\nHệ số bất bình đẳng trong phân phối thu nhập (hệ số Gini)\n204\n1806\nTỷ lệ dân số đô thị được cung cấp nước sạch qua hệ thống cấp nước tập trung\n205\n1807\nTỷ lệ dân số nông thôn sử dụng nước sạch đáp ứng quy chuẩn\n206\n1808\nTỷ lệ dân số được sử dụng nguồn nước hợp vệ sinh\n207\n1809\nTỷ lệ dân số sử dụng hố xí hợp vệ sinh\n208\n1810\nTiêu dùng năng lượng bình quân đầu người\n19. Trật tự, an toàn xã hội\n209\n1901\nSố vụ tai nạn giao thông; số người chết, bị thương do tai nạn giao thông\n210\n1902\nSố vụ cháy, nổ; số người chết, bị thương và thiệt hại về tài sản do cháy, nổ gây ra\n211\n1903\nSố vụ sự cố, số vụ tai nạn, số người cứu được, số thi thể nạn nhân tìm được trong hoạt động của lực lượng phòng cháy và chữa cháy\n212\n1904\nHệ số an toàn giao thông đường bộ\n213\n1905\nTỷ lệ dân số bị bạo lực\n20. Tư pháp\n214\n2001\nSố vụ án, số bị can đã khởi tố\n215\n2002\nSố vụ án, số bị can đã truy tố\n216\n2003\nSố vụ án, số bị cáo đã xét xử sơ thẩm\n217\n2004\nKết quả thi hành án dân sự\n218\n2005\nKết quả thi hành án hành chính\n219\n2006\nSố lượt người đã được trợ giúp pháp lý\n21. Bảo vệ môi trường\n220\n2101\nDiện tích rừng hiện có\n221\n2102\nTỷ lệ che phủ rừng\n222\n2103\nSố vụ thiên tai và mức độ thiệt hại\n223\n2104\nSố khu và diện tích các khu bảo tồn thiên nhiên\n224\n2105\nDiện tích đất bị thoái hoá\n225\n2106\nTỷ lệ chất thải nguy hại được thu gom, xử lý\n226\n2107\nTỷ lệ chất thải rắn sinh hoạt được thu gom, xử lý\n227\n2108\nTỷ lệ khu công nghiệp, khu chế xuất, khu công nghệ cao đang hoạt động có hệ thống xử lý nước thải tập trung đạt tiêu chuẩn môi trường\n228\n2109\nTỷ lệ cụm công nghiệp đang hoạt động có hệ thống xử lý nước thải tập trung đạt tiêu chuẩn môi trường\n229\n2110\nLượng phát thải khí nhà kính bình quân đầu người\n230\n2111\nTỷ lệ ngày trong năm có nồng độ bụi PM\n2,5\nvà PM\n10\ntrong môi trường không khí vượt quá quy chuẩn kỹ thuật môi trường cho phép tại các đô thị từ loại IV trở lên",
  "content_length": 15453,
  "crawled_at": "2025-12-11T16:51:00.747360"
}