{
  "id": "17065",
  "title": "Document 17065",
  "url": "https://vbpl.vn/TW/Pages/vbpq-toanvan.aspx?ItemID=17065",
  "info": {
    "STT": "Hàng hoá, dịch vụ",
    "I": "Hàng hoá",
    "1.": "Kinh doanh vũ trường, mát-xa, ka-ra-ô-kê",
    "2.": "Kinh doanh ca-si-nô, trò chơi bằng máy giắc-pót",
    "3.": "Kinh doanh giải trí có đặt cược",
    "4.": "Kinh doanh gôn: bán thẻ hội viên, vé chơi gôn",
    "5.": "Kinh doanh xổ số",
    "6.": "Điều hoà nhiệt độ công suất từ 90.000 BTU trở xuống",
    "7.": "Bài lá",
    "8.": "Vàng mã, hàng mã",
    "II": "Dịch vụ"
  },
  "content": "LUẬT\nSỬA ĐỔI, BỔ SUNG MỘT SỐ ĐIỀU CỦA LUẬT THUẾ TIÊU THỤ ĐẶC BIỆT VÀ LUẬT THUẾ GIÁ TRỊ GIA TĂNG\n______________________________\nCăn cứ vào Hiến pháp nước Cộng hoà xã hội chủ nghĩa Việt Nam năm 1992 đã được sửa đổi, bổ sung theo Nghị quyết số\n51/2001/QH10\nngày 25 tháng 12 năm 2001 của Quốc hội khoá X, kỳ họp thứ 10;\nLuật này sửa đổi, bổ sung một số điều của Luật thuế tiêu thụ đặc biệt ngày 20 tháng 5 năm 1998 đã được sửa đổi, bổ sung theo Luật sửa đổi, bổ sung một số điều của Luật thuế tiêu thụ đặc biệt ngày 17 tháng 06 năm 2003 và Luật thuế giá trị gia tăng ngày 10 tháng 5 năm 1997 đã được sửa đổi, bổ sung theo Luật sửa đổi, bổ sung một số điều của Luật thuế giá trị gia tăng ngày 17 tháng 06 năm 2003,\nĐiều 1\n.\nSửa đổi, bổ sung một số điều của Luật thuế tiêu thụ đặc biệt\n1. Khoản 6, Điều 6 được sửa đổi, bổ sung nh­ư sau:\n\"Điều 6. Giá tính thuế\n6. Đối với rượu, bia, kinh doanh ca-si-nô, trò chơi bằng máy giắc-pót, kinh doanh gôn, giá tính thuế tiêu thụ đặc biệt do Chính phủ quy định cụ thể.\nGiá tính thuế TTĐB đối với hàng hóa, dịch vụ quy định tại Điều này bao gồm cả khoản thu thêm mà cơ sở kinh doanh được hưởng.\nTrường hợp đối tượng nộp thuế có doanh số mua, bán bằng ngoại tệ thì phải quy đổi ngoại tệ ra đồng Việt Nam theo tỷ giá hối đoái do Ngân hàng Nhà nước Việt Nam công bố tại thời điểm phát sinh doanh số để xác định giá tính thuế.”\n2. Điều 7 được sửa đổi, bổ sung như sau:\n\" Điều 7. Thuế suất\nThuế suất thuế tiêu thụ đặc biệt đối với hàng hoá, dịch vụ được quy định theo Biểu thuế tiêu thụ đặc biệt sau đây:\nBIỂU THUẾ TIÊU THỤ ĐẶC BIỆT\nSTT\nHàng hoá, dịch vụ\nThuế suất (%)\nI\nHàng hoá\n1.\nThuốc lá điếu, xì gà\na) Xì gà\n65\nb) Thuốc lá điếu\n- Năm 2006-2007\n55\n- Từ năm 2008\n65\n2.\nRượu\na) Rượu từ 40 độ trở lên\n65\nb) Rượu từ 20 độ đến dưới 40 độ\n30\nc) Rượu dưới 20 độ, rượu hoa quả, rượu thuốc\n20\n3.\nBia\na) Bia chai, bia hép\n75\nb) Bia hơi, bia tươi\n- Năm 2006-2007\n30\n- Từ năm 2008\n40\n4.\nÔ tô\na) Ô tô từ 5 chỗ ngồi trở xuống\n50\nb) Ô tô từ 6 đến 15 chỗ ngồi\n30\nc) Ô tô từ 16 đến dưới 24 chỗ ngồi\n15\n5.\nXăng các loại, nap-ta (naptha), chế phẩm tái hợp và các chế phẩm khác dùng để pha chế xăng\n10\n6.\nĐiều hoà nhiệt độ công suất từ 90.000 BTU trở xuống\n15\n7.\nBài lá\n40\n8.\nVàng mã, hàng mã\n70\nII\nDịch vụ\n1.\nKinh doanh vũ trường, mát-xa, ka-ra-ô-kê\n30\n2.\nKinh doanh ca-si-nô, trò chơi bằng máy giắc-pót\n25\n3.\nKinh doanh giải trí có đặt cược\n25\n4.\nKinh doanh gôn: bán thẻ hội viên, vé chơi gôn\n10\n5.\nKinh doanh xổ số\n15\n3. Điều 16 được sửa đổi, bổ sung như sau:\n“ Điều 16. Những trường hợp được xét giảm thuế, miễn thuế tiêu thụ đặc biệt\nCơ sở sản xuất hàng hoá thuộc diện chịu thuế tiêu thụ đặc biệt gặp khó khăn do thiên tai, địch hoạ, tai nạn bất ngờ thì được xét giảm thuế, miễn thuế.\nChính phủ qui định cụ thể việc giảm thuế, miễn thuế qui định tại Điều này.”\nĐiều 2. Sửa đổi, bổ sung một số điều của Luật thuế giá trị gia tăng\n1. Khoản 1, Điều 4 được sửa đổi, bổ sung như sau:\n\" Điều 4. Đối tượng không thuộc diện chịu thuế giá trị gia tăng\nHàng hoá, dịch vụ dưới đây không thuộc diện chịu thuế giá trị gia tăng:\n1. Sản phẩm trồng trọt, chăn nuôi, thuỷ sản, hải sản nuôi trồng, đánh bắt chưa chế biến thành các sản phẩm khác hoặc chỉ qua sơ chế thông thường của tổ chức, cá nhân tự sản xuất, đánh bắt bán ra và ở khâu nhập khẩu.\n2 . Điểm k khoản 2 Điều 8 đã được sửa thành điểm ℓ khoản 2 Điều 8 theo Luật sửa đổi, bổ sung một số điều của Luật thuế giá trị gia tăng ngày 17 tháng 6 năm 2003 được sửa đổi, bổ sung như­ sau:\n“ Điều 8. Thuế suất\n...\n2. Mức thuế suất 5 % đối với hàng hoá, dịch vụ:\n...\nℓ) Bông sơ chế;\n...”\nĐiều 3.\nLuật này có hiệu lực thi hành từ ngày 01 tháng 01 năm 2006.\nĐiều 4.\nChính phủ quy định chi tiết và hướng dẫn thi hành Luật này.\nLuật này đã được Quốc hội nước Cộng hoà xã hội chủ nghĩa Việt Nam khoá XI, kỳ họp thứ 8 thông qua ngày 29 tháng 11 năm 2005./.",
  "content_length": 3800,
  "crawled_at": "2025-12-11T17:12:37.564362"
}