{
  "id": "20987",
  "title": "Document 20987",
  "url": "https://vbpl.vn/TW/Pages/vbpq-toanvan.aspx?ItemID=20987",
  "info": {
    "STT": "Hàng hoá, dịch vụ",
    "I-": "Hàng hoá",
    "1.": "Kinh doanh vũ trường, mát-xa, ka-ra-ô-kê",
    "2.": "Kinh doanh ca-si-nô, trò chơi bằng máy giắc-pót",
    "3.": "Kinh doanh giải trí có đặt cược",
    "4.": "Kinh doanh gôn: bán thẻ hội viên, vé chơi gôn",
    "5.": "Kinh doanh xổ số",
    "6.": "Điều hoà nhiệt độ công suất từ 90.000 BTU trở xuống",
    "7.": "Bài lá",
    "8.": "Vàng mã, hàng mã",
    "II-": "Dịch vụ"
  },
  "content": "LUẬT\nSửa đổi, bổ sung một số điều của Luật Thuế tiêu thụ đặc biệt\n----------------\nCăn cứ vào Hiến pháp nước Cộng hoà xã hội chủ nghĩa Việt Nam năm 1992 đã được sửa đổi, bổ sung theo Nghị quyết số\n51/2001/QH10\nngày 25 tháng 12 năm 2001 của Quốc hội khoá X, kỳ họp thứ 10;\nLuật này sửa đổi, bổ sung một số điều của Luật thuế tiêu thụ đặc biệt ngày 20 tháng 5 năm 1998.\nĐiều\n1. Sửa đổi, bổ sung một số điều của Luật thuế tiêu thụ đặc biệt:\n1- Điều 1 được sửa đổi, bổ sung như sau:\n\"Điều 1. Đối tượng chịu thuế\nHàng hóa, dịch vụ sau đây là đối tượng chịu thuế tiêu thụ đặc biệt:\n1. Hàng hóa:\na) Thuốc lá điếu, xì gà;\nb) Rượu;\nc) Bia;\nd) Ô tô dưới 24 chỗ ngồi;\nđ) Xăng các loại, nap-ta (naphtha), chế phẩm tái hợp (reformade component) và các chế phẩm khác để pha chế xăng;\ne) Điều hòa nhiệt độ công suất từ 90.000 BTU trở xuống;\ng) Bài lá;\nh) Vàng mã, hàng mã;\n2. Dịch vụ:\na) Kinh doanh vũ trường, mát-xa, ka-ra-ô-kê;\nb) Kinh doanh ca-si-nô (casino), trò chơi bằng máy giắc-pót (jackpot);\nc) Kinh doanh giải trí có đặt cược;\nd) Kinh doanh gôn (golf): bán thẻ hội viên, vé chơi gôn;\nđ) Kinh doanh xổ số.\"\n2- Khoản 6 Điều 6 được sửa đổi, bổ sung như sau:\n\"6. Đối với rượu, bia sản xuất trong nước, kinh doanh ca-si-nô, trò chơi bằng máy giắc-pót, kinh doanh gôn, giá tính thuế tiêu thụ đặc biệt do Chính phủ quy định cụ thể.\nGiá tính thuế tiêu thụ đặc biệt đối với hàng hoá, dịch vụ quy định tại Điều này bao gồm cả khoản thu thêm mà cơ sở kinh doanh được hưởng.\nTrường hợp đối tượng nộp thuế có doanh số mua, bán bằng ngoại tệ thì phải quy đổi ngoại tệ ra đồng Việt Nam theo tỷ giá hối đoái do Ngân hàng Nhà nước Việt Nam công bố tại thời điểm phát sinh doanh số để xác định giá tính thuế.\"\n3- Điều 7 được sửa đổi, bổ sung như sau:\n\"Điều 7. Thuế suất\nThuế suất thuế tiêu thụ đặc biệt đối với hàng hóa, dịch vụ được quy định theo Biểu thuế tiêu thụ đặc biệt sau đây:\nBIỂU THUẾ TIÊU THỤ ĐẶC BIỆT\nSTT\nHàng hoá, dịch vụ\nThuế suất (%)\nI-\nHàng hoá\n1.\nThuốc lá điếu, xì gà\na) Thuốc lá điếu có đầu lọc sản xuất chủ yếu bằng nguyên liệu nhập khẩu, xì gà\n65\nb) Thuốc lá điếu có đầu lọc sản xuất chủ yếu bằng nguyên liệu sản xuất trong nước\n45\nc) Thuốc lá điếu không đầu lọc\n25\n2.\nRượu\na) Rượu từ 40 độ trở lên\n75\nb) Rượu từ 20 độ đến dưới 40 độ\n30\nc) Rượu dưới 20 độ, rượu hoa quả\n20\nd) Rượu thuốc\n15\n3.\nBia\na) Bia chai, bia hộp, bia tươi\n75\nb) Bia hơi\n30\n4.\nÔ tô\na) Ô tô từ 5 chỗ ngồi trở xuống\n80\nb) Ô tô từ 6 đến 15 chỗ ngồi\n50\nc) Ô tô từ 16 đến dưới 24 chỗ ngồi\n25\n5.\nXăng các loại, nap-ta, chế phẩm tái hợp và các chế phẩm khác dùng để pha chế xăng\n10\n6.\nĐiều hoà nhiệt độ công suất từ 90.000 BTU trở xuống\n15\n7.\nBài lá\n40\n8.\nVàng mã, hàng mã\n70\nII-\nDịch vụ\n1.\nKinh doanh vũ trường, mát-xa, ka-ra-ô-kê\n30\n2.\nKinh doanh ca-si-nô, trò chơi bằng máy giắc-pót\n25\n3.\nKinh doanh giải trí có đặt cược\n25\n4.\nKinh doanh gôn: bán thẻ hội viên, vé chơi gôn\n10\n5.\nKinh doanh xổ số\n15\n4- Khoản 1 Điều 11 được sửa đổi, bổ sung như sau:\n\"1. Cơ sở sản xuất hàng hoá, kinh doanh dịch vụ chịu thuế tiêu thụ đặc biệt phải nộp thuế tiêu thụ đặc biệt vào ngân sách nhà nước tại nơi sản xuất, kinh doanh.\nThời hạn nộp thuế hàng tháng chậm nhất là ngày 25 của tháng tiếp theo;\"\n5- Bổ sung khoản 4 vào Điều 11 như sau:\n\"4. Chính phủ quy định cụ thể thủ tục kê khai, nộp thuế phù hợp với yêu cầu cải cách thủ tục hành chính, nâng cao ý thức trách nhiệm của cơ sở kinh doanh trước pháp luật, đồng thời tăng cường công tác thanh tra, kiểm tra xử lý vi phạm pháp luật của cơ quan thuế, bảo đảm quản lý thu thuế chặt chẽ, có hiệu quả.\"\n6- Khoản 2 Điều 14 được sửa đổi, bổ sung như sau:\n\"2. Thông báo số thuế phải nộp cho đối tượng nộp thuế do Chính phủ quy định, đôn đốc đối tượng nộp thuế nộp đúng thời hạn; nếu quá thời hạn nộp thuế mà đối tượng nộp thuế chưa nộp thì thông báo về số thuế phải nộp và số tiền phạt chậm nộp theo quy định tại khoản 2 và khoản 3 Điều 17 của Luật này; nếu đối tượng nộp thuế vẫn không nộp đủ số thuế, số tiền phạt theo thông báo thì có quyền áp dụng các biện pháp xử lý quy định tại khoản 4 Điều 17 của Luật này để bảo đảm thu đủ số thuế, số tiền phạt; nếu đã thực hiện các biện pháp xử lý nói trên mà đối tượng nộp thuế vẫn không nộp đủ số thuế, số tiền phạt thì chuyển hồ sơ đến cơ quan nhà nước có thẩm quyền để xử lý theo quy định của pháp luật.\"\n7- Bổ sung điểm đ vào khoản 1 Điều 15 như sau:\n\"đ) Kê khai giá bán làm căn cứ xác định giá tính thuế tiêu thụ đặc biệt thấp hơn 10% giá bán trên thị trường của hàng hoá, dịch vụ đó.\"\n8- Điều 16 được sửa đổi, bổ sung như sau:\n\"Điều 16\n. Những trường hợp được xét giảm thuế, miễn thuế tiêu thụ đặc biệt\n1. Cơ sở sản xuất hàng hoá thuộc diện chịu thuế tiêu thụ đặc biệt gặp khó khăn do thiên tai, địch hoạ, tai nạn bất ngờ thì được xét giảm thuế, miễn thuế.\n2. Cơ sở sản xuất, lắp ráp ô tô được giảm mức thuế suất theo Biểu thuế tiêu thụ đặc biệt quy định tại Điều 7 của Luật này như sau:\n- Năm 2004 giảm 70%.\n- Năm 2005 giảm 50%.\n- Năm 2006 giảm 30%.\n- Từ năm 2007 nộp đúng thuế suất quy định.\nChính phủ quy định cụ thể việc giảm thuế, miễn thuế quy định tại Điều này.\"\nĐiều 2\nLuật này có hiệu lực thi hành từ ngày 01 tháng 01 năm 2004.\nĐiều 3\nChính phủ quy định chi tiết và hướng dẫn thi hành Luật này.\nLuật này đã được Quốc hội nước Cộng hòa xã hội chủ nghĩa Việt Nam khóa XI, kỳ họp thứ 3 thông qua ngày 17 tháng 6 năm 2003.",
  "content_length": 5270,
  "crawled_at": "2025-12-11T17:16:41.920402"
}