{
  "id": "23778",
  "title": "Document 23778",
  "url": "https://vbpl.vn/TW/Pages/vbpq-toanvan.aspx?ItemID=23778",
  "info": {
    "Số thứ tự": "Nhóm, loại tài nguyên",
    "I": "Khoáng sản kim loại",
    "1": "Nước khoáng thiên nhiên, nước nóng thiên nhiên, nước thiên nhiên tinh lọc đóng chai, đóng hộp",
    "2": "Nước thiên nhiên dùng cho sản xuất thủy điện",
    "3": "Nước thiên nhiên dùng cho sản xuất, kinh doanh, trừ nước quy định tại điểm 1 và điểm 2 Nhóm này",
    "4": "Gỗ nhóm V, VI, VII, VIII và các loại gỗ khác",
    "5": "Cành, ngọn, gốc, rễ",
    "6": "Củi",
    "7": "Tre, trúc, nứa, mai, giang, tranh, vầu, lồ ô",
    "8": "Trầm hương, kỳ nam",
    "9": "Hồi, quế, sa nhân, thảo quả",
    "II": "Khoáng sản không kim loại",
    "10": "Sản phẩm khác của rừng tự nhiên",
    "11": "Than nâu, than mỡ",
    "12": "Than khác",
    "13": "Kim cương, ru-bi (rubi), sa-phia (sapphire)",
    "14": "E-mô-rốt (emerald), a-lếch-xan-đờ-rít (alexandrite), màu đen",
    "15": "Adít, rô-đô-lít (rodolite), py-rốp (pyrope), bê-rin (berin), sờ-pi-nen (spinen), tô-paz (topaz)",
    "16": "Thạch anh tinh thể màu tím xanh, vàng lục, da cam; cờ-ri-ô-lít (cryolite); ô-pan (pan) quý màu trắng, đỏ lửa; phen-sờ-phát (fenspat); birusa; nê-phờ-rít (nefrite)",
    "17": "Khoáng sản không kim loại khác",
    "III": "Dầu thô",
    "IV": "Khí thiên nhiên, khí than",
    "V": "Sản phẩm của rừng tự nhiên",
    "VI": "Hải sản tự nhiên",
    "VII": "Nước thiên nhiên",
    "3.1": "Nước mặt",
    "3.2": "Nước dưới đất",
    "VIII": "Yến sào thiên nhiên",
    "IX": "Tài nguyên khác"
  },
  "content": "LUẬT\nThuế tài nguyên\n_______\nCăn cứ Hiến pháp nước Cộng hoà xã hội chủ nghĩa Việt Nam năm 1992 đã được sửa đổi, bổ sung một số điều theo Nghị quyết số\n51/2001/QH10;\nQuốc hội ban hành Luật thuế tài nguyên.\nChương I\nNHỮNG QUY ĐỊNH CHUNG\nĐiều 1. Phạm vi điều chỉnh\nLuật này quy định về đối tượng chịu thuế, người nộp thuế, căn cứ tính thuế, kê khai thuế, nộp thuế, miễn thuế, giảm thuế tài nguyên.\nĐiều 2. Đối tượng chịu thuế\n1. Khoáng sản kim loại.\n2. Khoáng sản không kim loại.\n3. Dầu thô.\n4. Khí thiên nhiên, khí than.\n5. Sản phẩm của rừng tự nhiên, trừ động vật.\n6. Hải sản tự nhiên, bao gồm động vật và thực vật biển.\n7. Nước thiên nhiên, bao gồm nước mặt và nước dưới đất.\n8. Yến sào thiên nhiên.\n9. Tài nguyên khác do Uỷ ban thường vụ Quốc hội quy định.\nĐiều 3. Người nộp thuế\n1. Người nộp thuế tài nguyên là tổ chức, cá nhân khai thác tài nguyên thuộc đối tượng chịu thuế tài nguyên.\n2. Người nộp thuế tài nguyên trong một số trường hợp được quy định cụ thể như sau:\na) Doanh nghiệp khai thác tài nguyên được thành lập trên cơ sở liên doanh thì doanh nghiệp liên doanh là người nộp thuế;\nb) Bên Việt Nam và bên nước ngoài tham gia hợp đồng hợp tác kinh doanh khai thác tài nguyên thì trách nhiệm nộp thuế của các bên phải được xác định cụ thể trong hợp đồng hợp tác kinh doanh;\nc) Tổ chức, cá nhân khai thác tài nguyên nhỏ, lẻ bán cho tổ chức, cá nhân làm đầu mối thu mua và tổ chức, cá nhân làm đầu mối thu mua cam kết chấp thuận bằng văn bản về việc kê khai, nộp thuế thay cho tổ chức, cá nhân khai thác thì tổ chức, cá nhân làm đầu mối thu mua là người nộp thuế.\nChương II\nCĂN CỨ TÍNH THUẾ\nĐiều 4. Căn cứ tính thuế\nCăn cứ tính thuế tài nguyên là sản lượng tài nguyên tính thuế, giá tính thuế và thuế suất\nĐiều 5. Sản lượng tài nguyên tính thuế\n1. Đối với tài nguyên khai thác xác định được số lượng, trọng lượng hoặc khối lượng thì sản lượng tài nguyên tính thuế là số lượng, trọng lượng hoặc khối lượng của tài nguyên thực tế khai thác trong kỳ tính thuế.\n2. Đối với tài nguyên khai thác chưa xác định được số lượng, trọng lượng hoặc khối lượng thực tế khai thác do chứa nhiều chất, tạp chất khác nhau thì sản lượng tài nguyên tính thuế được xác định theo số lượng, trọng lượng hoặc khối lượng của từng chất thu được sau khi sàng tuyển, phân loại.\n3. Đối với tài nguyên khai thác không bán mà đưa vào sản xuất sản phẩm khác nếu không trực tiếp xác định được số lượng, trọng lượng hoặc khối lượng thực tế khai thác thì sản lượng tài nguyên tính thuế được xác định căn cứ vào sản lượng sản phẩm sản xuất trong kỳ tính thuế và định mức sử dụng tài nguyên tính trên một đơn vị sản phẩm.\n4. Đối với nước thiên nhiên dùng cho sản xuất thuỷ điện thì sản lượng tài nguyên tính thuế là sản lượng điện của cơ sở sản xuất thuỷ điện bán cho bên mua điện theo hợp đồng mua bán điện hoặc sản lượng điện giao nhận trong trường hợp không có hợp đồng mua bán điện được xác định theo hệ thống đo đếm đạt tiêu chuẩn đo lường chất lượng Việt Nam, có xác nhận của bên mua, bên bán hoặc bên giao, bên nhận.\n5. Đối với nước khoáng thiên nhiên, nước nóng thiên nhiên, nước thiên nhiên dùng cho mục đích công nghiệp thì sản lượng tài nguyên tính thuế được xác định bằng mét khối (m3) hoặc lít (I) theo hệ thống đo đếm đạt tiêu chuẩn đo lường chất lượng Việt Nam.\n6. Đối với tài nguyên được khai thác thủ công, phân tán hoặc khai thác lưu động, không thường xuyên, sản lượng tài nguyên khai thác dự kiến trong một năm có giá trị dưới 200.000.000 đồng thì thực hiện khoán sản lượng tài nguyên khai thác theo mùa vụ hoặc định kỳ để tính thuế. Cơ quan thuế phối hợp với cơ quan có liên quan ở địa phương xác định sản lượng tài nguyên khai thác được khoán để tính thuế.\nChính phủ quy định chi tiết Điều này.\nĐiều 6. Giá tính thuế\n1. Giá tính thuế tài nguyên là giá bán đơn vị sản phẩm tài nguyên của tổ chức, cá nhân khai thác chưa bao gồm thuế giá trị gia tăng.\n2. Trường hợp tài nguyên chưa xác định được giá bán thì giá tính thuế tài nguyên được xác định theo một trong những căn cứ sau:\na) Giá bán thực tế trên thị trường khu vực của đơn vị sản phẩm tài nguyên cùng loại nhưng không thấp hơn giá tính thuế do Uỷ ban nhân dân tỉnh, thành phố trực thuộc Trung ương (sau đây gọi chung là Uỷ ban nhân dân cấp tỉnh) quy định;\nb) Trường hợp tài nguyên khai thác có chứa nhiều chất khác nhau thì giá tính thuế xác định theo giá bán đơn vị của từng chất và hàm lượng của từng chất trong tài nguyên khai thác nhưng không thấp hơn giá tính thuế do Uỷ ban nhân dân cấp tỉnh quy định.\n3. Giá tính thuế tài nguyên trong một số trường hợp được quy định cụ thể như sau:\na) Đối với nước thiên nhiên dùng cho sản xuất thủy điện là giá bán điện thương phẩm bình quân;\nb) Đối với gỗ là giá bán tại bãi giao; trường hợp chưa xác định được giá bán tại bãi giao thì giá tính thuế được xác định căn cứ vào giá tính thuế do Uỷ ban nhân dân cấp tỉnh quy định;\nc) Đối với tài nguyên khai thác không tiêu thụ trong nước mà xuất khẩu là giá xuất khẩu;\nd) Đối với dầu thô, khí thiên nhiên, khí than là giá bán tại điểm giao nhận. Điểm giao nhận là điểm được thoả thuận trong hợp đồng dầu mà ở đó dầu thô, khí thiên nhiên, khí than được chuyển giao quyền sở hữu cho các bên tham gia hợp đồng dầu khí.\n4. Uỷ ban nhân dân cấp tỉnh quy định cụ thể giá tính thuế đối với tài nguyên chưa xác định được giá bán đơn vị sản phẩm tài nguyên, trừ dầu thô, khí thiên nhiên, khí than và nước thiên nhiên dùng cho sản xuất thủy điện.\nChính phủ quy định chi tiết Điều này.\nĐiều 7. Thuế suất\n1. Biểu khung thuế suất thuế tài nguyên được quy định như sau:\nSố thứ tự\nNhóm, loại tài nguyên\nThuế suất (%)\nI\nKhoáng sản kim loại\n1\nSắt, măng-gan (mangan)\n7-20\n2\nTi-tan (titan)\n7-20\n3\nVàng\n9-25\n4\nĐất hiếm\n12-25\n5\nBạch kim, bạc, thiếc\n7-25\n6\nVôn-phờ-ram (wolfram), ăng-ti-moan (antimoan)\n7-25\n7\nChì, kẽm, nhôm, bô-xit (bouxite), đồng, ni-ken (niken)\n7-25\n8\nCô-ban (coban), mô-lip-đen (molipden), thuỷ ngân, ma-nhê (magie), va-na-đi (vanadi)\n7-25\n9\nKhoáng sản kim loại khác\n5-25\nII\nKhoáng sản không kim loại\n1\nĐất khai thác để san lấp, xây dựng công trình\n3-10\n2\nĐá, trừ đá nung vôi và sản xuất xi măng; sỏi; cát, trừ cát làm thủy tinh\n5-15\n3\nĐất làm gạch\n5-15\n4\nGờ-ra-nít (granite), sét chịu lửa\n7-20\n5\nĐô-lô-mít (dolomite), quắc-zít (quartzite)\n7-20\n6\nCao lanh, mi-ca (mica), thạch anh kỹ thuật, cát làm thủy tinh\n7-15\n7\nPi-rít (pirite), phốt-pho-rít (phosphorite), đá nung vôi và sản xuất xi măng\n5-15\n8\nA-pa-tít (apatit), séc-păng-tin (secpentin)\n3-10\n9\nThan an-tra-xít (antraxit) hầm lò\n4-20\n10\nThan an-tra-xít (antraxit) lộ thiên\n6-20\n11\nThan nâu, than mỡ\n6-20\n12\nThan khác\n4-20\n13\nKim cương, ru-bi (rubi), sa-phia (sapphire)\n16-30\n14\nE-mô-rốt (emerald), a-lếch-xan-đờ-rít (alexandrite), màu đen\n16-30\n15\nAdít, rô-đô-lít (rodolite), py-rốp (pyrope), bê-rin (berin), sờ-pi-nen (spinen), tô-paz (topaz)\n12-25\n16\nThạch anh tinh thể màu tím xanh, vàng lục, da cam; cờ-ri-ô-lít (cryolite); ô-pan (pan) quý màu trắng, đỏ lửa; phen-sờ-phát (fenspat); birusa; nê-phờ-rít (nefrite)\n12-25\n17\nKhoáng sản không kim loại khác\n4-25\nIII\nDầu thô\n6-40\nIV\nKhí thiên nhiên, khí than\n1-30\nV\nSản phẩm của rừng tự nhiên\n1\nGỗ nhóm I\n25-35\n2\nGỗ nhóm II\n20-30\n3\nGỗ nhóm III, IV\n15-20\n4\nGỗ nhóm V, VI, VII, VIII và các loại gỗ khác\n10-15\n5\nCành, ngọn, gốc, rễ\n10-20\n6\nCủi\n1-5\n7\nTre, trúc, nứa, mai, giang, tranh, vầu, lồ ô\n10-15\n8\nTrầm hương, kỳ nam\n25-30\n9\nHồi, quế, sa nhân, thảo quả\n10-15\n10\nSản phẩm khác của rừng tự nhiên\n5-15\nVI\nHải sản tự nhiên\n1\nNgọc trai, bào ngư, hải sâm\n6-10\n2\nHải sản tự nhiên khác\n1-5\nVII\nNước thiên nhiên\n1\nNước khoáng thiên nhiên, nước nóng thiên nhiên, nước thiên nhiên tinh lọc đóng chai, đóng hộp\n8-10\n2\nNước thiên nhiên dùng cho sản xuất thủy điện\n2-5\n3\nNước thiên nhiên dùng cho sản xuất, kinh doanh, trừ nước quy định tại điểm 1 và điểm 2 Nhóm này\n3.1\nNước mặt\n1-3\n3.2\nNước dưới đất\n3-8\nVIII\nYến sào thiên nhiên\n10-20\nIX\nTài nguyên khác\n1-20\n2. Thuế suất cụ thể đối với dầu thô, khí thiên nhiên, khí than được xác định lũy tiến từng phần theo sản lượng dầu thô, khí thiên nhiên, khí than khai thác bình quân mỗi ngày.\n3. Căn cứ vào quy định tại khoản 1 và khoản 2 Điều này, Uỷ ban thường vụ Quốc hội quy định mức thuế suất cụ thể đối với từng loại tài nguyên trong từng thời kỳ bảo đảm các nguyên tắc sau:\na) Phù hợp với danh mục nhóm, loại tài nguyên và trong phạm vi khung thuế suất do Quốc hội quy định;\nb) Góp phần quản lý nhà nước đối với tài nguyên; bảo vệ, khai thác, sử dụng hợp lý, tiết kiệm và hiệu quả nguồn tài nguyên;\nc) Góp phần bảo đảm nguồn thu ngân sách nhà nước và bình ổn thị trường.\nChương III\nKÊ KHAI, NỘP THUẾ , MIỄN, GIẢM THUẾ\nĐiều 8. Kê khai, nộp thuế\nNgười nộp thuế tài nguyên thực hiện đăng ký, kê khai, tính và nộp thuế theo quy định của pháp luật về quản lý thuế.\nĐiều 9. Miễn, giảm thuế\n1. Người nộp thuế tài nguyên gặp thiên tai, hoả hoạn, tai nạn bất ngờ gây tổn thất đến tài nguyên đã kê khai, nộp thuế thì được xét miễn, giảm thuế phải nộp cho số tài nguyên bị tổn thất; trường hợp đã nộp thuế thì được hoàn trả số thuế đã nộp hoặc trừ vào số thuế tài nguyên phải nộp của kỳ sau.\n2. Miễn thuế đối với hải sản tự nhiên.\n3. Miễn thuế đối với cành, ngọn, củi, tre, trúc, nứa, mai, giang, tranh, vầu, lồ ô do cá nhân được phép khai thác phục vụ sinh hoạt.\n4. Miễn thuế đối với nước thiên nhiên dùng cho sản xuất thuỷ điện của hộ gia đình, cá nhân tự sản xuất phục vụ sinh hoạt.\n5. Miễn thuế đối với nước thiên nhiên dùng cho nông nghiệp, lâm nghiệp, ngư nghiệp, diêm nghiệp; nước thiên nhiên do hộ gia đình, cá nhân khai thác phục vụ sinh hoạt.\n6. Miễn thuế đối với đất khai thác và sử dụng tại chỗ trên diện tích đất được giao, được thuê; đất khai thác để san lấp, xây dựng công trình an ninh, quân sự, đê điều.\n7. Trường hợp khác được miễn, giảm thuế do Uỷ ban thường vụ Quốc hội quy định.\nChương IV\nĐIỀU KHOẢN THI HÀNH\nĐiều 10. Hiệu lực thi hành\n1. Luật này có hiệu lực thi hành từ ngày 01 tháng 7 năm 2010.\n2. Các văn bản quy phạm pháp luật sau đây hết hiệu lực thi hành kể từ ngày Luật này có hiệu lực:\na) Pháp lệnh thuế tài nguyên số\n05/1998/PL-UBTVQH10;\nb) Pháp lệnh sửa đổi, bổ sung Điều 6 Pháp lệnh thuế tài nguyên số\n07/2008/PL-UBTVQH12\n.\n3. Đối với dự án đầu tư hoặc hợp đồng dầu khí đã được ký kết trước ngày 01 tháng 7 năm 2010 mà trong Giấy phép đầu tư, Giấy chứng nhận đầu tư hoặc hợp đồng dầu khí có quy định về thuế tài nguyên thì thực hiện theo quy định tại Giấy phép đầu tư, Giấy chứng nhận đầu tư hoặc hợp đồng dầu khí đã ký kết. Trường hợp ưu đãi về thuế tài nguyên quy định tại Giấy phép đầu tư, Giấy chứng nhận đầu tư hoặc hợp đồng dầu khí thấp hơn ưu đãi về thuế tài nguyên quy định tại Luật này thì áp dụng ưu đãi về thuế theo quy định của Luật này cho thời gian còn lại.\nĐiều 11. Quy định chi tiết và hướng dẫn thi hành\nChính phủ quy định chi tiết, hướng dẫn thi hành các điều, khoản được giao trong Luật; hướng dẫn những nội dung cần thiết khác của Luật này để đáp ứng yêu cầu quản lý nhà nước.\nLuật này đã được Quốc hội nước Cộng hoà xã hội chủ nghĩa Việt Nam khoá XII, kỳ họp thứ 6 thông qua ngày 25 tháng 11 năm 2009./.",
  "content_length": 10925,
  "crawled_at": "2025-12-11T17:06:57.434632"
}