{
  "id": "26354",
  "title": "Document 26354",
  "url": "https://vbpl.vn/TW/Pages/vbpq-toanvan.aspx?ItemID=26354",
  "info": {
    "Số thứ tự": "Hàng hóa",
    "I": "Xăng, dầu, mỡ nhờn",
    "1": "Than nâu",
    "2": "Than an-tra-xít (antraxit)",
    "3": "Than mỡ",
    "4": "Than đá khác",
    "5": "Dầu mazut",
    "6": "Dầu nhờn",
    "7": "Mỡ nhờn",
    "II": "Than đá",
    "III": "Dung dịch Hydro-chloro-fluoro-carbon (HCFC)",
    "IV": "Túi ni lông thuộc diện chịu thuế",
    "V": "Thuốc diệt cỏ thuộc loại hạn chế sử dụng",
    "VI": "Thuốc trừ mối thuộc loại hạn chế sử dụng",
    "VII": "Thuốc bảo quản lâm sản thuộc loại hạn chế sử dụng",
    "VIII": "Thuốc khử trùng kho thuộc loại hạn chế sử dụng"
  },
  "content": "LUẬT\nThuế bảo vệ môi trường\n___________\nCăn cứ Hiến pháp nước Cộng hòa xã hội chủ nghĩa Việt Nam năm 1992 đã được sửa đổi, bổ sung một số điều theo Nghị quyết số\n51/2001/QH10;\nQuốc hội ban hành Luật thuế bảo vệ môi trường,\nChương\nI\nNHỮNG QUY ĐỊNH CHUNG\nĐiều\n1. Phạm vi điều chỉnh\nLuật này quy định về đối tượng chịu thuế, đối tượng không chịu thuế, người nộp thuế, căn cứ tính thuế, khai thuế, tính thuế, nộp thuế và hoàn thuế bảo vệ môi trường.\nĐiều\n2. Giải thích từ ngữ\nTrong Luật này, các từ ngữ dưới đây được hiểu như sau:\n1.\nThuế bảo vệ môi trường\nlà loại thuế gián thu, thu vào sản phẩm, hàng hóa (sau đây gọi chung là hàng hóa) khi sử dụng gây tác động xấu đến môi trường.\n2.\nMức thuế tuyệt đối\nlà mức thuế được quy định bằng số tiền tính trên một đơn vị hàng hóa chịu thuế.\n3.\nTúi ni lông thuộc diện chịu thuế\nlà loại túi, bao bì được làm từ màng nhựa đơn polyetylen, tên kỹ thuật là túi nhựa xốp.\n4.\nDung dịch hydro-chloro-fluoro-carbon\n(HCFC) là nhóm chất gây suy giảm tầng ô dôn dùng làm môi chất lạnh.\nĐiều\n3. Đối tượng chịu thuế\n1. Xăng, dầu, mỡ nhờn, bao gồm:\na) Xăng, trừ etanol;\nb) Nhiên liệu bay;\nc) Dầu diezel;\nd) Dầu hỏa;\nđ) Dầu mazut;\ne) Dầu nhờn;\ng) Mỡ nhờn.\n2. Than đá, bao gồm:\na) Than nâu;\nb) Than an-tra-xít (antraxit);\nc) Than mỡ;\nd) Than đá khác.\n3. Dung dịch hydro-chloro-fluoro-carbon (HCFC).\n4. Túi ni lông thuộc diện chịu thuế.\n5. Thuốc diệt cỏ thuộc loại hạn chế sử dụng.\n6. Thuốc trừ mối thuộc loại hạn chế sử dụng.\n7. Thuốc bảo quản lâm sản thuộc loại hạn chế sử dụng.\n8. Thuốc khử trùng kho thuộc loại hạn chế sử dụng.\n9. Trường hợp xét thấy cần thiết phải bổ sung đối tượng chịu thuế khác cho phù hợp với từng thời kỳ thì Ủy ban thường vụ Quốc hội xem xét, quy định.\nChính phủ quy định chi tiết Điều này.\nĐiều\n4. Đối tượng không chịu thuế\n1. Hàng hóa không quy định tại Điều 3 của Luật này không thuộc đối tượng chịu thuế bảo vệ môi trường.\n2. Hàng hóa quy định tại Điều 3 của Luật này không chịu thuế bảo vệ môi trường trong các trường hợp sau:\na) Hàng hóa vận chuyển quá cảnh hoặc chuyển khẩu qua cửa khẩu, biên giới Việt Nam theo quy định của pháp luật, bao gồm hàng hóa được vận chuyển từ nước xuất khẩu đến nước nhập khẩu qua cửa khẩu Việt Nam nhưng không làm thủ tục nhập khẩu vào Việt Nam và không làm thủ tục xuất khẩu ra khỏi Việt Nam; hàng hóa quá cảnh qua cửa khẩu, biên giới Việt Nam trên cơ sở Hiệp định ký kết giữa Chính phủ Việt Nam và Chính phủ nước ngoài hoặc thỏa thuận giữa cơ quan, người đại diện được Chính phủ Việt Nam và Chính phủ nước ngoài ủy quyền theo quy định của pháp luật;\nb) Hàng hóa tạm nhập khẩu, tái xuất khẩu trong thời hạn theo quy định của pháp luật;\nc) Hàng hóa do cơ sở sản xuất trực tiếp xuất khẩu hoặc ủy thác cho cơ sở kinh doanh xuất khẩu để xuất khẩu, trừ trường hợp tổ chức, hộ gia đình, cá nhân mua hàng hóa thuộc đối tượng chịu thuế bảo vệ môi trường để xuất khẩu.\nĐiều\n5. Người nộp thuế\n1. Người nộp thuế bảo vệ môi trường là tổ chức, hộ gia đình, cá nhân sản xuất, nhập khẩu hàng hóa thuộc đối tượng chịu thuế quy định tại Điều 3 của Luật này.\n2. Người nộp thuế bảo vệ môi trường trong một số trường hợp cụ thể được quy định như sau:\na) Trường hợp ủy thác nhập khẩu hàng hóa thì người nhận ủy thác nhập khẩu là người nộp thuế;\nb) Trường hợp tổ chức, hộ gia đình, cá nhân làm đầu mối thu mua than khai thác nhỏ, lẻ mà không xuất trình được chứng từ chứng minh hàng hóa đã được nộp thuế bảo vệ môi trường thì tổ chức, hộ gia đình, cá nhân làm đầu mối thu mua là người nộp thuế.\nChương\nII\nCĂN CỨ TÍNH THUẾ\nĐiều\n6. Căn cứ tính thuế\n1. Căn cứ tính thuế bảo vệ môi trường là số lượng hàng hóa tính thuế và mức thuế tuyệt đối.\n2. Số lượng hàng hóa tính thuế được quy định như sau:\na) Đối với hàng hóa sản xuất trong nước, số lượng hàng hóa tính thuế là số lượng hàng hóa sản xuất bán ra, trao đổi, tiêu dùng nội bộ, tặng cho;\nb) Đối với hàng hóa nhập khẩu, số lượng hàng hóa tính thuế là số lượng hàng hóa nhập khẩu.\n3. Mức thuế tuyệt đối để tính thuế được quy định tại Điều 8 của Luật này.\nĐiều\n7. Phương pháp tính thuế\nSố thuế bảo vệ môi trường phải nộp bằng số lượng đơn vị hàng hóa chịu thuế nhân với mức thuế tuyệt đối quy định trên một đơn vị hàng hóa.\nĐiều\n8. Biểu khung thuế\n1. Mức thuế tuyệt đối được quy định theo Biểu khung thuế dưới đây:\nSố thứ tự\nHàng hóa\nĐơn vị tính\nMức thuế\n(đồng/1 đơn vị hàng hóa)\nI\nXăng, dầu, mỡ nhờn\n1\nXăng, trừ etanol\nLít\n1.000-4.000\n2\nNhiên liệu bay\nLít\n1.000-3.000\n3\nDầu diezel\nLít\n500-2.000\n4\nDầu hỏa\nLít\n300-2.000\n5\nDầu mazut\nLít\n300-2.000\n6\nDầu nhờn\nLít\n300-2.000\n7\nMỡ nhờn\nKg\n300-2.000\nII\nThan đá\n1\nThan nâu\nTấn\n10.000-30.000\n2\nThan an-tra-xít (antraxit)\nTấn\n20.000-50.000\n3\nThan mỡ\nTấn\n10.000-30.000\n4\nThan đá khác\nTấn\n10.000-30.000\nIII\nDung dịch Hydro-chloro-fluoro-carbon (HCFC)\nkg\n1.000-5.000\nIV\nTúi ni lông thuộc diện chịu thuế\nkg\n30.000-50.000\nV\nThuốc diệt cỏ thuộc loại hạn chế sử dụng\nkg\n500-2.000\nVI\nThuốc trừ mối thuộc loại hạn chế sử dụng\nkg\n1.000-3.000\nVII\nThuốc bảo quản lâm sản thuộc loại hạn chế sử dụng\nkg\n1.000-3.000\nVIII\nThuốc khử trùng kho thuộc loại hạn chế sử dụng\nkg\n1.000-3.000\n2. Căn cứ vào Biểu khung thuế quy định tại khoản 1 Điều này, Ủy ban thường vụ Quốc hội quy định mức thuế cụ thể đối với từng loại hàng hóa chịu thuế bảo đảm các nguyên tắc sau:\na) Mức thuế đối với hàng hóa chịu thuế phù hợp với chính sách phát triển kinh tế - xã hội của Nhà nước trong từng thời kỳ;\nb) Mức thuế đối với hàng hóa chịu thuế được xác định theo mức độ gây tác động xấu đến môi trường của hàng hóa.\nChương\nIII\nKHAI THUẾ, TÍNH THUẾ, NỘP THUẾ VÀ HOÀN THUẾ\nĐiều\n9. Thời điểm tính thuế\n1. Đối với hàng hóa sản xuất bán ra, trao đổi, tặng cho, thời điểm tính thuế là thời điểm chuyển giao quyền sở hữu hoặc quyền sử dụng hàng hóa.\n2. Đối với hàng hóa sản xuất đưa vào tiêu dùng nội bộ, thời điểm tính thuế là thời điểm đưa hàng hóa vào sử dụng.\n3. Đối với hàng hóa nhập khẩu, thời điểm tính thuế là thời điểm đăng ký tờ khai hải quan.\n4. Đối với xăng, dầu sản xuất hoặc nhập khẩu để bán, thời điểm tính thuế là thời điểm đầu mối kinh doanh xăng, dầu bán ra.\nĐiều\n10. Khai thuế, tính thuế, nộp thuế\n1. Việc khai thuế, tính thuế, nộp thuế bảo vệ môi trường đối với hàng hóa sản xuất bán ra, trao đổi, tiêu dùng nội bộ, tặng cho được thực hiện theo tháng và theo quy định của pháp luật về quản lý thuế.\n2. Việc khai thuế, tính thuế, nộp thuế bảo vệ môi trường đối với hàng hóa nhập khẩu được thực hiện cùng thời điểm với khai thuế và nộp thuế nhập khẩu.\n3. Thuế bảo vệ môi trường chỉ nộp một lần đối với hàng hóa sản xuất hoặc nhập khẩu.\nĐiều\n11. Hoàn thuế\nNgười nộp thuế bảo vệ môi trường được hoàn thuế đã nộp trong các trường hợp sau:\n1. Hàng hóa nhập khẩu còn lưu kho, lưu bãi tại cửa khẩu và đang chịu sự giám sát của cơ quan Hải quan được tái xuất khẩu ra nước ngoài;\n2. Hàng hóa nhập khẩu để giao, bán cho nước ngoài thông qua đại lý tại Việt Nam; xăng, dầu bán cho phương tiện vận tải của hãng nước ngoài trên tuyến đường qua cảng Việt Nam hoặc phương tiện vận tải của Việt Nam trên tuyến đường vận tải quốc tế theo quy định của pháp luật;\n3. Hàng hóa tạm nhập khẩu để tái xuất khẩu theo phương thức kinh doanh hàng tạm nhập, tái xuất.\n4. Hàng hóa nhập khẩu do người nhập khẩu tái xuất khẩu ra nước ngoài;\n5. Hàng hóa tạm nhập khẩu để tham gia hội chợ, triển lãm, giới thiệu sản phẩm theo quy định của pháp luật khi tái xuất khẩu ra nước ngoài.\nChương\nIV\nĐIỀU KHOẢN THI HÀNH\nĐiều\n12. Hiệu lực thi hành\n1. Luật này có hiệu lực thi hành từ ngày 01 tháng 01 năm 2012.\n2. Các quy định về thu phí xăng, dầu tại Pháp lệnh về phí và lệ phí số\n38/2001/PL-UBTVQH10\nhết hiệu lực thi hành từ ngày Luật này có hiệu lực.\nĐiều\n13. Quy định chi tiết và hướng dẫn thi hành\nChính phủ quy định chi tiết và hướng dẫn thi hành các điều, khoản được giao trong Luật; hướng dẫn những nội dung cần thiết khác của Luật này để đáp ứng yêu cầu quản lý nhà nước.\nLuật này đã được Quốc hội nước Cộng hòa xã hội chủ nghĩa Việt Nam khóa XII, kỳ họp thứ 8 thông qua ngày 15 tháng 11 năm 2010./.",
  "content_length": 7896,
  "crawled_at": "2025-12-11T17:05:32.913625"
}