{
  "id": "46809",
  "title": "Document 46809",
  "url": "https://vbpl.vn/TW/Pages/vbpq-toanvan.aspx?ItemID=46809",
  "info": {
    "STT": "Hàng hóa, dịch vụ",
    "I": "Hàng hóa",
    "1": "Kinh doanh vũ trường",
    "2": "Kinh doanh mát-xa, ka-ra-ô-kê",
    "3": "Kinh doanh ca-si-nô, trò chơi điện tử có thưởng",
    "4": "Kinh doanh đặt cược",
    "5": "Kinh doanh gôn",
    "6": "Kinh doanh xổ số",
    "7": "Du thuyền",
    "8": "Xăng các loại",
    "9": "Điều hòa nhiệt độ công suất từ 90.000 BTU trở xuống",
    "10": "Bài lá",
    "11": "Vàng mã, hàng mã",
    "II": "Dịch vụ"
  },
  "content": "LUẬT\nSửa đổi, bổ sung một số điều của Luật Thuế tiêu thụ đặc biệt\n_____________________\nCăn cứ Hiến pháp nước Cộng hòa xã hội chủ nghĩa Việt Nam;\nQuốc hội ban hành Luật sửa đổi, bổ sung một số điều của Luật Thuế tiêu thụ đặc biệt số\n27/2008/QH12.\nĐiều\n1.\nSửa đổi, bổ sung một số điều của Luật thuế tiêu thụ đặc biệt.\n1. Sửa đổi điểm g khoản 1 Điều 2 như sau:\n“g) Xăng các loại;”\n2. Khoản 3 Điều 3 được sửa đổi, bổ sung như sau:\n“3. Tàu bay, du thuyền sử dụng cho mục đích kinh doanh vận chuyển hàng hóa, hành khách, khách du lịch và tàu bay sử dụng cho mục đích an ninh, quốc phòng;”\n3. Đoạn đầu Điều 6 được sửa đổi, bổ sung như sau:\n“Giá tính thuế tiêu thụ đặc biệt đối với hàng hóa, dịch vụ là giá bán ra, giá cung ứng dịch vụ chưa có thuế tiêu thụ đặc biệt, chưa có thuế bảo vệ môi trường và chưa có thuế giá trị gia tăng được quy định như sau:”\n4. Điều 7 được sửa đổi, bổ sung như sau:\n“Điều 7. Thuế suất\nThuế suất thuế tiêu thụ đặc biệt đối với hàng hóa, dịch vụ được quy định theo Biểu thuế tiêu thụ đặc biệt sau đây:\nBIỂU THUẾ TIÊU THỤ ĐẶC BIỆT\nSTT\nHàng hóa, dịch vụ\nThuế suất\n(%)\nI\nHàng hóa\n1\nThuốc lá điếu, xì gà và các chế phẩm khác từ cây thuốc lá\nTừ ngày 01 tháng 01 năm 2016 đến hết ngày 31 tháng 12 năm 2018\n70\nTừ ngày 01 tháng 01 năm 2019\n75\n2\nRượu\na) Rượu từ 20 độ trở lên\nTừ ngày 01 tháng 01 năm 2016 đến hết ngày 31 tháng 12 năm 2016\n55\nTừ ngày 01 tháng 01 năm 2017 đến hết ngày 31 tháng 12 năm 2017\n60\nTừ ngày 01 tháng 01 năm 2018\n65\nb) Rượu dưới 20 độ\nTừ ngày 01 tháng 01 năm 2016 đến hết ngày 31 tháng 12 năm 2017\n30\nTừ ngày 01 tháng 01 năm 2018\n35\n3\nBia\nTừ ngày 01 tháng 01 năm 2016 đến hết ngày 31 tháng 12 năm 2016\n55\nTừ ngày 01 tháng 01 năm 2017 đến hết ngày 31 tháng 12 năm 2017\n60\nTừ ngày 01 tháng 01 năm 2018\n65\n4\nXe ô tô dưới 24 chỗ\na) Xe ô tô chở người từ 9 chỗ trở xuống, trừ loại quy định tại điểm 4đ, 4e và 4g của Biểu thuế quy định tại Điều này\nLoại có dung tích xi lanh từ 2.000 cm\n3\ntrở xuống\n45\nLoại có dung tích xi lanh trên 2.000 cm\n3\nđến 3.000 cm\n3\n50\nLoại có dung tích xi lanh trên 3.000 cm\n3\n60\nb) Xe ô tô chở người từ 10 đến dưới 16 chỗ, trừ loại quy định tại điểm 4đ, 4e và 4g của Biểu thuế quy định tại Điều này\n30\nc) Xe ô tô chở người từ 16 đến dưới 24 chỗ, trừ loại quy định tại điểm 4đ, 4e và 4g của Biểu thuế quy định tại Điều này\n15\nd) Xe ô tô vừa chở người, vừa chở hàng, trừ loại quy định tại điểm 4đ, 4e và 4g của Biểu thuế quy định tại Điều này\n15\nđ) Xe ô tô chạy bằng xăng kết hợp năng lượng điện, năng lượng sinh học, trong đó tỷ trọng xăng sử dụng không quá 70% số năng lượng sử dụng.\nBằng 70% mức thuế suất áp dụng cho xe cùng loại quy định tại điểm 4a, 4b, 4c và 4d của Biểu thuế quy định tại Điều này\ne) Xe ô tô chạy bằng năng lượng sinh học\nBằng 50% mức thuế suất áp dụng cho xe cùng loại quy định tại điểm 4a, 4b, 4c và 4d của Biểu thuế quy định tại Điều này\ng) Xe ô tô chạy bằng điện\nLoại chở người từ 9 chỗ trở xuống\n25\nLoại chở người từ 10 đến dưới 16 chỗ\n15\nLoại chở người từ 16 đến dưới 24 chỗ\n10\nLoại thiết kế vừa chở người, vừa chở hàng\n10\n5\nXe mô tô hai bánh, xe mô tô ba bánh có dung tích xi lanh trên 125 cm\n3\n20\n6\nTàu bay\n30\n7\nDu thuyền\n30\n8\nXăng các loại\na) Xăng\n10\nb) Xăng E5\n8\nc) Xăng E10\n7\n9\nĐiều hòa nhiệt độ công suất từ 90.000 BTU trở xuống\n10\n10\nBài lá\n40\n11\nVàng mã, hàng mã\n70\nII\nDịch vụ\n1\nKinh doanh vũ trường\n40\n2\nKinh doanh mát-xa, ka-ra-ô-kê\n30\n3\nKinh doanh ca-si-nô, trò chơi điện tử có thưởng\n35\n4\nKinh doanh đặt cược\n30\n5\nKinh doanh gôn\n20\n6\nKinh doanh xổ số\n15\nĐiều\n2.\nLuật này có hiệu lực thi hành từ ngày 01 tháng 01 năm 2016.\nLuật này đã được Quốc hội nước Cộng hòa xã hội chủ nghĩa Việt Nam khóa XIII, kỳ họp thứ 8 thông qua ngày 26 tháng 11 năm 2014./.",
  "content_length": 3648,
  "crawled_at": "2025-12-11T17:00:23.154494"
}