{
  "id": "9703",
  "title": "Document 9703",
  "url": "https://vbpl.vn/TW/Pages/vbpq-toanvan.aspx?ItemID=9703",
  "info": {
    "Số TT": "Ngành nghề",
    "1": "Dịch vụ sửa chữa thuộc các ngành nghề",
    "2": "Dịch vụ khoa học kỹ thuật",
    "3": "Dịch vụ tư vấn pháp luật",
    "4": "Dịch vụ bưu điện, bưu chính viễn thông",
    "5": "Dịch vụ y tế, thể dục, thể thao, văn hoá nghệ thuật, dạy nghề",
    "6": "Các hoạt động dịch vụ, nghiệp vụ khác (trừ hoạt động tín dụng) của các tổ chức ngân hàng, tín dụng, công ty tài chính",
    "7": "Bảo hiểm",
    "8": "Cầm đồ",
    "9": "Xếp dỡ hàng hoá, cho thuê kho, bến bãi, xưởng sản, máy móc, thiết bị, phương tiện vận tải",
    "10": "Cho thuê nhà, cửa hàng, đồ dùng, phòng cưới, hội trường, xe hơi du lịch",
    "11": "Kinh doanh khách sạn, phòng ngủ, dịch vụ du lịch, thăm quan",
    "12": "Chụp, in, phóng ảnh, phô tô, quy video, chiếu video",
    "13": "In băng, sang băng, cho thuê băng",
    "14": "Uốn tóc, may đo, nhuộm, giặt là, tẩy hấp",
    "15": "Các loại dịch vụ khác",
    "16": "Dịch vụ đặc biệt:",
    "17": "Sản phẩm bằng da, bằng vải giả da",
    "18": "In và xuất bản (không bao gồm hoạt động quảng cáo):",
    "19": "Dụng cụ thí nghiệm, dụng cụ y tế, đồ chơi trẻ em, giáo cụ giảng dạy và học tập",
    "20": "Dụng cụ thể dục, thể thao, nhạc cụ và phụ tùng",
    "21": "Thuốc chữa bệnh, thuốc phòng dịch bệnh; bông băng vệ sinh y tế",
    "22": "Sản xuất hàng mỹ nghệ",
    "23": "Sản xuất hàng mỹ phẩm",
    "24": "Sản xuất bài lá, vàng mã, hương, nến :",
    "25": "Sản xuất, chế biến thức ăn gia súc",
    "26": "Sản xuất nông nghiệp không thuộc diện chịu thuế sử dụng đất nông nghiệp",
    "27": "Sản xuất các loại công cụ sản xuất",
    "28": "Gia công không phân biệt sản phẩm, ngành nghề (tính trên tiền gia công)",
    "29": "Sản xuất, chế biến khác"
  },
  "content": "LUẬT\nSỬA ĐỔI, BỔ SUNG MỘT SỐ ĐIỀU CỦA LUẬT THUẾ DOANH THU\nCăn cứ vào Điều 80 và Điều 84 của Hiến pháp nước Cộng hoà xã hội chủ nghĩa Việt Nam năm 1992;\nLuật này sửa đổi, bổ sung một số điều của Luật thuế doanh thu đã được Quốc hội khoá VIII, kỳ họp thứ 7 thông qua ngày 30 tháng 6 năm 1990 và Luật sửa đổi, bổ sung một số điều của Luật thuế doanh thu đã được Quốc hội nước Cộng hoà xã hội chủ nghĩa Việt Nam khoá IX, kỳ họp thứ 3 thông qua ngày 05 tháng 7 năm 1993.\nĐiều 1\nSửa đổi, bổ sung một số điều của Luật thuế doanh thu như sau:\n1- Điều 2 được sửa đổi, bổ sung:\n\"Điều 2\nNhững hoạt động sau đây không thuộc diện chịu thuế doanh thu:\n1- Sản xuất nông nghiệp thuộc diện chịu thuế sử dụng đất nông nghiệp;\n2- Sản xuất hàng hoá thuộc diện chịu thuế tiêu thụ đặc biệt;\n3- Sản xuất hàng hoá xuất khẩu;\n4- Hoạt động tín dụng.\"\n2- Điều 8 được sửa đổi, bổ sung:\n\"Điều 8\n1- Doanh thu tính thuế là toàn bộ tiền thu từ hoạt động kinh doanh ở Việt Nam, không phân biết ngành, nghề, hình thức kinh doanh, có cơ sở kinh doanh ở Việt Nam hay ở nước ngoài.\nDoanh thu tính thuế đối với một số hoạt động kinh doanh được quy định như sau:\na) Doanh thu đối với hoạt động sản xuất là tiền bán hàng;\nb) Doanh thu đối với hoạt động gia công là tiền gia công bao gồm tiền công, tiền nhiên liệu, động lực, vật liệu phụ và các chi phí khác;\nc) Doanh thu đối với hoạt động xây dựng là tiền thu về xây dựng.\nĐối với hoạt động lắp đặt máy móc, thiết bị toàn bộ gắn với xây dựng, doanh thu tính thuế đối với hoạt động này không tính giá trị máy móc thiết bị;\nd) Doanh thu đối với hoạt động vận tải là tiền thu cước phí vận chuyển hàng hoá, hành khách, hành lý;\ne) Doanh thu đối với hoạt động ăn uống là tiền thu về kinh doanh ăn uống;\ng) Doanh thu đối với hoạt động kinh doanh thương nghiệp là tiền bán hàng hoặc là số chênh lệch giữa giá bán hàng với giá mua hàng;\nh) Doanh thu đối với hoạt động đại lý bán hàng hoặc uỷ thác mua, bán hàng là tiền hoa hồng được hưởng;\ni) Doanh thu đối với hoạt động dịch vụ là tiền thu về hoạt động dịch vụ;\nk) Doanh thu đối với hoạt động bảo hiểm là tiền thu về kinh doanh bảo hiểm.\n2- Cơ sở kinh doanh có doanh thu bằng ngoại tệ, được nộp thuế bằng ngoại tệ hoặc bằng đồng tiền Việt Nam, quy đổi theo tỷ giá mua vào do Ngân hàng Nhà nước Việt Nam công bố tại thời điểm nộp thuế.\n3- Trong trường hợp trao đổi hàng hoá, dịch vụ hoặc tự cung ứng hàng hoá, tự cung ứng dịch vụ, thì hàng hoá, dịch vụ trao đổi hoặc tự cung ứng phải được tính thành tiền tại thời điểm phát sinh, theo giá thị trường để làm căn cứ tính thuế.\"\nĐiều 2\nSửa đổi, bổ sung thuế suất thuế doanh thu đối với một số ngành nghề kinh doanh trong Biểu thuế doanh thu hiện hành và ban hành kèm theo Luật này Biểu thuế doanh thu đã được sửa đổi, bổ sung.\nĐiều 3\nLuật này có hiệu lực từ ngày 01 tháng 01 năm 1996.\nĐiều 4\nChính phủ sửa đổ, bổ sung các văn bản quy định chi tiết thi hành Luật thuế doanh thu cho phù hợp với Luật này.\nLuật này được Quốc hội nước Cộng hoà xã hội chủ nghĩa Việt Nam khoá IX, kỳ họp thứ 8 thông qua ngày 28 tháng 10 năm 1995.\nBIỂU THUẾ DOANH THU ĐÃ SỬA ĐỔI, BỔ SUNG\n(Ban hành kèm theo Luật sửa đổi, bổ sung một số điều của\nLuật thuế doanh thu đã được Quốc hội khoá IX, kỳ họp thứ 8\nthông qua ngày 28 tháng 10 năm 1995)\nSố TT\nNgành nghề\nThuế suất (%)\n1\n2\n3\nI- Ngành sản xuất\n1\nĐiện thương phẩm\n8\n2\nKhai thác các loại tài nguyên khoáng sản:\na) Dầu mỏ, khí đốt, vàng, đá quý\n8\nb) Lâm sản\n4\nc) Thủy sản, tài nguyên và khoáng sản khác\n2\nRiêng khai thác than hầm lò\n1\n3\nSản xuất nước sạch phục vụ sản xuất và sinh hoạt\n1\n4\nLuyện, cán, kéo kim loại và luyện cốc\n2\nRiêng: luyện, cán, kèo kim loại màu, kim loại quý (vàng, bạc)\n4\n5\nSản xuất, lắp ráp sản phẩm cơ khí\n2\nRiêng: - Máy móc, thiết bị, phương tiện vận tải\n1\n- Quạt điện, bàn là, biến thế và ổn áp điện dưới 15A, bơm nước điện dưới 10m3/giờ, máy giặt, điều hoà nhiệt độ, tủ lạnh, máy hút bụi, hút ẩm, bình nóng lạnh, đồ dùng có gắn bộ phận điện (nồi cơm điện, ấm điện, chảo điện, máy xay sinh tố...), bếp ga, bếp điện, sản xuất, lắp ráp ô tô từ 24 chỗ ngồi trở xuống\n4\n6\nSản xuất, lắp ráp sản phẩm điện tử\n8\nRiêng: Máy móc, thiết bị điện tử chuyên dùng, máy vi tính\n4\n7\nSản phẩm hoá chất\n4\nRiêng: - Hoá chất cơ bản, phân bón\n1\n- Thuốc trừ sâu, mối, mọt, côn trùng và các hoá chất khác phục vụ sản xuất nông nghiệp\n0,5\n- Dầu mỡ nhờn\n2\n8\nVật liệu xây dựng, kể cả cơ-lanh-ke, vữa bê tông, bê tông đúc sắn\n4\nRiêng xi măng: - Mác P300 trở lên\n10\n- Mác dưới P300\n6\n9\nGốm, sành sứ, thuỷ tinh\n4\nRiêng thuỷ tinh dùng cho y tế\n1\n10\nChế biến lâm sản và sản xuất đồ gỗ\n6\n11\nGiấy và sản phẩm bằng giấy\n2\nRiêng: Bột giấy, giấy in báo và giấy vở học sinh\n1\n12\nXay, xát, chế biến lương thực\n2\nRiêng mỳ ăn liền\n6\n13\nSản xuất, chế biến thực phẩm (bao gồm cả thuốc lá lá, thuốc lá sợi, thuốc lào, cồn, cà phê, mỳ chính, đường, bánh kẹo...)\n6\nRiêng: - Muối\n0,5\n- Nước đá dùng cho đánh bắt thuỷ sản\n2\n- Bột canh, nước chấm các loại, dầu thực vật, chè, sữa các loại\n4\n- Nước ngọt, nước giải khát\n8\n14\nChế biến thuỷ sản\n4\n15\nSợi, dệt, bông:\na) Sợi các loại (bao gồm cả sợi len dệt thảm, sợi đay, tơ, cói), chỉ\n2\nRiêng: Sợi len, sợi tổng hợp\n4\nb) Dệt các loại\n4\nRiêng: Dệt đay, chiếu, cói, mành và các sản phẩm dệt thủ công, bán cơ khí\n2\nc) Sơ chế bông trồng trong nước\n1\n16\nSản phẩm may mặc bằng vải, giầy vải, sản xuất nguyên liệu da, vải giả da\n4\n17\nSản phẩm bằng da, bằng vải giả da\n6\n18\nIn và xuất bản (không bao gồm hoạt động quảng cáo):\na) Sách, phim ảnh (kể cả in tráng phim nhựa); băng nhạc, băng hình, đĩa quang đã ghi chương trình\n1\nb) Báo các loại\n0,5\nc) Sách chính trị, sách giáo khoa, sách khoa học kỹ thuật, sách phục vụ thiếu nhi, sách báo in bằng tiếng dân tộc, báo nhân dân, báo quân đội nhân dân, tranh ảnh lãnh tụ, áp phích, tranh ảnh tuyên truyền, in tiền; phim tài liệu, phóng sự, đề tài cách mạng, đề tài thiếu nhi, đề tài khoa học\n0\nd) Sản xuất băng nhạc, băng hình chưa ghi chương trình\n2\ne) In và xuất bản các loại khác, các hoạt động khác thuộc ngành in, xuất bản\n4\n19\nDụng cụ thí nghiệm, dụng cụ y tế, đồ chơi trẻ em, giáo cụ giảng dạy và học tập\n0,5\n20\nDụng cụ thể dục, thể thao, nhạc cụ và phụ tùng\n1\n21\nThuốc chữa bệnh, thuốc phòng dịch bệnh; bông băng vệ sinh y tế\n1\n22\nSản xuất hàng mỹ nghệ\n8\n23\nSản xuất hàng mỹ phẩm\n10\n24\nSản xuất bài lá, vàng mã, hương, nến :\na) Bài lá, vàng mã\n20\nb) Hương, nến\n8\n25\nSản xuất, chế biến thức ăn gia súc\n2\n26\nSản xuất nông nghiệp không thuộc diện chịu thuế sử dụng đất nông nghiệp\n2\nRiêng: Sản xuất cây giống, con giống\n1\n27\nSản xuất các loại công cụ sản xuất\n1\n28\nGia công không phân biệt sản phẩm, ngành nghề (tính trên tiền gia công)\n6\n29\nSản xuất, chế biến khác\n4\nII- Ngành xây dựng\n1\nHoạt động xây lắp; hoạt động khảo sát, thiết kế và hoạt động khác trong xây dựng\n4\nIII. Ngành vận tải\n1\nVận tải hàng hoá\n2\nRiêng: Vận tải bằng phương tiện thô sơ ở miền núi, hải đảo\n0,5\n2\nVận tải hành khách, hành lý; vận tải hàng không (kể cả hành khách, hành lý và hàng hoá)\n4\nRiêng vận tải hành khách nội thành nội thị bằng xe buýt\n1\nIV- Ngành thương nghiệp\n1\nKinh doanh bán các loại hàng hoá (kể cả: xăng, xe gắn máy, ôtô từ 24 chỗ ngồi trở xuống)\n2\nRiêng: Lương thực, thực phẩm tươi sống, rau quả tươi sống, muối, thuốc chữa bệnh, dụng cụ thí nghiệm, dụng cụ y tế, phân bón, thuốc trừ sâu, thuốc trừ mối mọt côn trùng, máy móc, thiết bị (bao gồm cả máy vi tính, máy fax, máy photo), phương tiện vận tải, phụ tùng máy móc, nguyên vật liệu, nhiên liệu, sách báo, giáo cụ giảng dạy và học tập, đồ chơi trẻ em, cây giống, con giống, phát hành phim\n1\n2\nKinh doanh xuất khẩu\n1\n3\nKinh doanh vàng, bạc, đá quý\n1\n4\nKinh doanh ngoại tệ\n0,5\n5\nKinh doanh bất động sản (kể cả xây nhà để bán)\n4\n6\nĐại lý bán hàng, bán hàng ký gửi, uỷ thác mua, bán hàng (tính trên tiền hoa hồng)\n15\n7\nCơ sở kinh doanh (trừ buôn chuyến) có hoá đơn chứng từ, có ghi chép sổ sách kế toán đúng chế độ được cơ quan thuế công nhận thì được tính và nộp thuế doanh thu trên chênh lệch giữa giá bán hàng với giá mua hàng\n15\nRiêng: - Kinh doanh vàng, bạc, đá quý, ngoại tệ, bất động sản\n20\n- Phát hành sách, báo, phim\n4\n- Kinh doanh muối\n4\n- Kinh doanh nông sản, thực phẩm tươi sống, rau quả tươi sống\n10\nV- Ngành ăn uống\n1\nKinh doanh ăn uống\n6\nRiêng: Cửa hàng ăn uống cao cấp, đặc sản\n10\nVI- Ngành dịch vụ\n1\nDịch vụ sửa chữa thuộc các ngành nghề\n4\nRiêng: - Sửa chữa máy móc, thiết bị, phương tiện vận tải\n2\n- Sửa chữa đồ điện, điện tử, điện lạnh\n6\n2\nDịch vụ khoa học kỹ thuật\n2\n3\nDịch vụ tư vấn pháp luật\n4\n4\nDịch vụ bưu điện, bưu chính viễn thông\n6\n5\nDịch vụ y tế, thể dục, thể thao, văn hoá nghệ thuật, dạy nghề\n0,5\nRiêng: Biểu diễn nghệ thuật, (xiếc, tuồng, chèo, cải lương, kịch nói, múa rối, ca múa nhạc...), chiếu phim nhựa\n0\n6\nCác hoạt động dịch vụ, nghiệp vụ khác (trừ hoạt động tín dụng) của các tổ chức ngân hàng, tín dụng, công ty tài chính\n6\n7\nBảo hiểm\n4\nRiêng: - Bảo hiểm học sinh\n0\n- Bảo hiểm vật nuôi, cây trồng\n0\n8\nCầm đồ\n4\n9\nXếp dỡ hàng hoá, cho thuê kho, bến bãi, xưởng sản, máy móc, thiết bị, phương tiện vận tải\n4\n10\nCho thuê nhà, cửa hàng, đồ dùng, phòng cưới, hội trường, xe hơi du lịch\n10\n11\nKinh doanh khách sạn, phòng ngủ, dịch vụ du lịch, thăm quan\n10\nRiêng kinh doanh nhà trọ\n6\n12\nChụp, in, phóng ảnh, phô tô, quy video, chiếu video\n6\n13\nIn băng, sang băng, cho thuê băng\n8\n14\nUốn tóc, may đo, nhuộm, giặt là, tẩy hấp\n6\n15\nCác loại dịch vụ khác\n4\nRiêng: Dịch vụ vệ sinh, thoát nước đường phố; tang lễ\n0\n16\nDịch vụ đặc biệt:\na/ Mỹ viện\n10\nb/ Khiêu vũ\n30\nc/ Karaoke, tắm hơi, mát xa\n20\nd/ Đua ngựa\n20\ne/ Kinh doanh sân gôn\n20\ng/ Xổ số kiển thiết và các hình thức xổ số khác\n30\nRiêng: xổ số kiến thiết các tỉnh miền núi và các hình thức xổ số cào biết kết quả ngay, xổ số lô tô\n20\ng) Đại lý tàu biển\n30\nh) Môi giới\n15\ni) Quảng cáo\n10",
  "content_length": 9603,
  "crawled_at": "2025-12-11T17:22:40.676212"
}